adult,backdrop_path,original_language,original_title,overview,popularity,poster_path,release_date,title,video,vote_average,vote_count,genres,tmdbUrl
False,/lgkPzcOSnTvjeMnuFzozRO5HHw1.jpg,en,Despicable Me 4,"Gru and Lucy and their girls—Margo, Edith and Agnes—welcome a new member to the Gru family, Gru Jr., who is intent on tormenting his dad. Gru also faces a new nemesis in Maxime Le Mal and his femme fatale girlfriend Valentina, forcing the family to go on the run.",3824.644,/wWba3TaojhK7NdycRhoQpsG0FaH.jpg,2024-06-20,Despicable Me 4,False,7.257,612,"Animation,Family,Comedy,Action",https://www.themoviedb.org/movie/519182
False,/stKGOm8UyhuLPR9sZLjs5AkmncA.jpg,en,Inside Out 2,"Teenager Riley's mind headquarters is undergoing a sudden demolition to make room for something entirely unexpected: new Emotions! Joy, Sadness, Anger, Fear and Disgust, who’ve long been running a successful operation by all accounts, aren’t sure how to feel when Anxiety shows up. And it looks like she’s not alone.",3628.807,/vpnVM9B6NMmQpWeZvzLvDESb2QY.jpg,2024-06-11,Inside Out 2,False,7.626,2271,"Animation,Family,Adventure,Comedy",https://www.themoviedb.org/movie/1022789
False,/Akv9GlCCMrzcDkVz4ad8MdLl9DK.jpg,en,The Garfield Movie,"Garfield, the world-famous, Monday-hating, lasagna-loving indoor cat, is about to have a wild outdoor adventure! After an unexpected reunion with his long-lost father – scruffy street cat Vic – Garfield and his canine friend Odie are forced from their perfectly pampered life into joining Vic in a hilarious, high-stakes heist.",1476.332,/p6AbOJvMQhBmffd0PIv0u8ghWeY.jpg,2024-04-30,The Garfield Movie,False,7.207,677,"Animation,Comedy,Family,Adventure",https://www.themoviedb.org/movie/748783
False,/1XDDXPXGiI8id7MrUxK36ke7gkX.jpg,en,Kung Fu Panda 4,"Po is gearing up to become the spiritual leader of his Valley of Peace, but also needs someone to take his place as Dragon Warrior. As such, he will train a new kung fu practitioner for the spot and will encounter a villain called the Chameleon who conjures villains from the past.",536.13,/kDp1vUBnMpe8ak4rjgl3cLELqjU.jpg,2024-03-02,Kung Fu Panda 4,False,7.136,2365,"Animation,Family,Fantasy",https://www.themoviedb.org/movie/1011985
FALSE,/auXrHU6O17n9Tz11SHReoorjrU6.jpg,en,Leo,"Jaded 74-year-old lizard Leo has been stuck in the same Florida classroom for decades with his terrarium-mate turtle. When he learns he only has one year left to live, he plans to escape to experience life on the outside but instead gets caught up in the problems of his anxious students — including an impossibly mean substitute teacher.",198.608,/pD6sL4vntUOXHmuvJPPZAgvyfd9.jpg,2023-11-17,Leo,FALSE,7.496,994,"Animation,Comedy,Family",https://www.themoviedb.org/movie/1075794
FALSE,/ehumsuIBbgAe1hg343oszCLrAfI.jpg,en,Wish,"Asha, a sharp-witted idealist, makes a wish so powerful that it is answered by a cosmic force – a little ball of boundless energy called Star. Together, Asha and Star confront a most formidable foe - the ruler of Rosas, King Magnifico - to save her community and prove that when the will of one courageous human connects with the magic of the stars, wondrous things can happen.",413.369,/AcoVfiv1rrWOmAdpnAMnM56ki19.jpg,2023-11-13,Wish,FALSE,6.617,878,"Animation,Family,Fantasy,Adventure",https://www.themoviedb.org/movie/1022796
FALSE,/aNG1BSIULxbHtUmBiar0i3fR1S4.jpg,en,Chicken Run: Dawn of the Nugget,A band of fearless chickens flock together to save poultry-kind from an unsettling new threat: a nearby farm that's cooking up something suspicious.,111.749,/uR03YFvc7rZg8Yb1uOKekIS084A.jpg,2023-12-08,Chicken Run: Dawn of the Nugget,FALSE,7.082,607,"Family,Animation,Adventure,Comedy",https://www.themoviedb.org/movie/520758
FALSE,/gklkxY0veMajdCiGe6ggsh07VG2.jpg,en,Migration,"After a migrating duck family alights on their pond with thrilling tales of far-flung places, the Mallard family embarks on a family road trip, from New England, to New York City, to tropical Jamaica.",813.287,/ldfCF9RhR40mppkzmftxapaHeTo.jpg,2023-12-06,Migration,FALSE,7.564,951,"Animation,Action,Adventure,Comedy,Family",https://www.themoviedb.org/movie/940551
FALSE,/zMtBbNhROxPf0urHSBoZUnqJEwT.jpg,en,Trolls Band Together,"When Branch's brother, Floyd, is kidnapped for his musical talents by a pair of nefarious pop-star villains, Branch and Poppy embark on a harrowing and emotional journey to reunite the other brothers and rescue Floyd from a fate even worse than pop-culture obscurity.",229.524,/bkpPTZUdq31UGDovmszsg2CchiI.jpg,2023-10-12,Trolls Band Together,FALSE,7.317,693,"Animation,Family,Music,Fantasy,Comedy",https://www.themoviedb.org/movie/901362
FALSE,/2Cpg8hUn60PK9CW9d5SWf605Ah8.jpg,en,Teenage Mutant Ninja Turtles: Mutant Mayhem,"After years of being sheltered from the human world, the Turtle brothers set out to win the hearts of New Yorkers and be accepted as normal teenagers through heroic acts. Their new friend April O'Neil helps them take on a mysterious crime syndicate, but they soon get in over their heads when an army of mutants is unleashed upon them.",119.923,/ueO9MYIOHO7M1PiMUeX74uf8fB9.jpg,2023-07-31,Teenage Mutant Ninja Turtles: Mutant Mayhem,FALSE,7.263,1102,"Animation,Comedy,Action,Science Fiction",https://www.themoviedb.org/movie/614930
FALSE,/a0GM57AnJtNi7lMOCamniiyV10W.jpg,ja,君たちはどう生きるか,"While the Second World War rages, the teenage Mahito, haunted by his mother's tragic death, is relocated from Tokyo to the serene rural home of his new stepmother Natsuko, a woman who bears a striking resemblance to the boy's mother. As he tries to adjust, this strange new world grows even stranger following the appearance of a persistent gray heron, who perplexes and bedevils Mahito, dubbing him the ""long-awaited one.""",403.696,/f4oZTcfGrVTXKTWg157AwikXqmP.jpg,2023-07-14,The Boy and the Heron,FALSE,7.441,1106,"Animation,Adventure,Fantasy",https://www.themoviedb.org/movie/508883
FALSE,/7drO1kYgQ0PnnU87sAnBEphYrSM.jpg,ja,バイオハザード：デスアイランド,"In San Francisco, Jill Valentine is dealing with a zombie outbreak and a new T-Virus, Leon Kennedy is on the trail of a kidnapped DARPA scientist, and Claire Redfield is investigating a monstrous fish that is killing whales in the bay. Joined by Chris Redfield and Rebecca Chambers, they discover the trail of clues from their separate cases all converge on the same location, Alcatraz Island, where a new evil has taken residence and awaits their arrival.",108.363,/qayga07ICNDswm0cMJ8P3VwklFZ.jpg,2023-06-22,Resident Evil: Death Island,FALSE,7.454,862,"Animation,Action,Horror",https://www.themoviedb.org/movie/1083862
FALSE,/f7UI3dYpr7ZUHGo0iIr1Qvy1VPe.jpg,en,"Ruby Gillman, Teenage Kraken","Ruby Gillman, a sweet and awkward high school student, discovers she's a direct descendant of the warrior kraken queens. The kraken are sworn to protect the oceans of the world against the vain, power-hungry mermaids. Destined to inherit the throne from her commanding grandmother, Ruby must use her newfound powers to protect those she loves most.",99.497,/8ChIb3WzYAcza1vrXR56v510MWk.jpg,2023-06-28,"Ruby Gillman, Teenage Kraken",FALSE,7.313,865,"Animation,Family,Fantasy,Comedy",https://www.themoviedb.org/movie/1040148
FALSE,/4QpKxH614YFIsmiIBVUbsnG2H8w.jpg,en,Nimona,"A knight framed for a tragic crime teams with a scrappy, shape-shifting teen to prove his innocence.",66.345,/2NQljeavtfl22207D1kxLpa4LS3.jpg,2023-06-23,Nimona,FALSE,7.928,884,"Adventure,Animation,Fantasy,Family",https://www.themoviedb.org/movie/961323
FALSE,/iEFuHjqrE059SmflBva1JzDJutE.jpg,fr,Miraculous - le film,"After a guardian of magical jewels turns an awkward girl and a popular boy into superheroes, they can never reveal their identities — even to each other.",138.856,/dQNJ8SdCMn3zWwHzzQD2xrphR1X.jpg,2023-07-05,"Miraculous: Ladybug & Cat Noir, The Movie",FALSE,7.7,772,"Animation,Fantasy,Action,Romance,Family",https://www.themoviedb.org/movie/496450
FALSE,/9xfDWXAUbFXQK585JvByT5pEAhe.jpg,en,Spider-Man: Across the Spider-Verse,"After reuniting with Gwen Stacy, Brooklyn’s full-time, friendly neighborhood Spider-Man is catapulted across the Multiverse, where he encounters the Spider Society, a team of Spider-People charged with protecting the Multiverse’s very existence. But when the heroes clash on how to handle a new threat, Miles finds himself pitted against the other Spiders and must set out on his own to save those he loves most.",296.448,/8Vt6mWEReuy4Of61Lnj5Xj704m8.jpg,2023-05-31,Spider-Man: Across the Spider-Verse,FALSE,8.377,5984,"Animation,Action,Adventure,Science Fiction",https://www.themoviedb.org/movie/569094
FALSE,/pA4sNvcohTNPx3AhEEeIu8gSt7h.jpg,en,Elemental,"In a city where fire, water, land and air residents live together, a fiery young woman and a go-with-the-flow guy will discover something elemental: how much they have in common.",232.752,/4Y1WNkd88JXmGfhtWR7dmDAo1T2.jpg,2023-06-14,Elemental,FALSE,7.7,3829,"Animation,Comedy,Family,Fantasy,Romance,Adventure",https://www.themoviedb.org/movie/976573
FALSE,/9n2tJBplPbgR2ca05hS5CKXwP2c.jpg,en,The Super Mario Bros. Movie,"While working underground to fix a water main, Brooklyn plumbers—and brothers—Mario and Luigi are transported down a mysterious pipe and wander into a magical new world. But when the brothers are separated, Mario embarks on an epic quest to find Luigi.",296.824,/qNBAXBIQlnOThrVvA6mA2B5ggV6.jpg,2023-04-05,The Super Mario Bros. Movie,FALSE,7.7,8183,"Animation,Family,Adventure,Fantasy,Comedy",https://www.themoviedb.org/movie/502356
FALSE,/lyHmhoRj3zXSdeCYbs2oOXLCF4K.jpg,uk,Мавка: Лісова пісня,"Forest soul Mavka faces an impossible choice between her heart and her duty as guardian to the Heart of the Forest, when she falls in love with the talented young human musician Lukas.",113.076,/8v7g3nydS5Ga2wBgdCNC70Y9ykk.jpg,2023-03-02,Mavka: The Forest Song,FALSE,7.286,627,"Animation,Adventure,Family,Fantasy",https://www.themoviedb.org/movie/459003
FALSE,/jr8tSoJGj33XLgFBy6lmZhpGQNu.jpg,en,Puss in Boots: The Last Wish,"Puss in Boots discovers that his passion for adventure has taken its toll: He has burned through eight of his nine lives, leaving him with only one life left. Puss sets out on an epic journey to find the mythical Last Wish and restore his nine lives.",237.895,/kuf6dutpsT0vSVehic3EZIqkOBt.jpg,2022-12-07,Puss in Boots: The Last Wish,FALSE,8.244,7099,"Animation,Adventure,Fantasy,Comedy,Action,Family",https://www.themoviedb.org/movie/315162
FALSE,/5wDBVictj4wUYZ31gR5WzCM9dLD.jpg,en,Strange World,"A journey deep into an uncharted and treacherous land, where fantastical creatures await the legendary Clades—a family of explorers whose differences threaten to topple their latest, and by far most crucial, mission.",39.641,/fHMqfsYyl3lskPK2RiFRwhzwuep.jpg,2022-11-23,Strange World,FALSE,6.358,1157,"Animation,Family,Adventure,Science Fiction,Fantasy",https://www.themoviedb.org/movie/877269
FALSE,/4tdV5AeojEdbvn6VpeQrbuDlmzs.jpg,ja,すずめの戸締まり,"Suzume, 17, lost her mother as a little girl. On her way to school, she meets a mysterious young man. But her curiosity unleashes a calamity that endangers the entire population of Japan, and so Suzume embarks on a journey to set things right.",111.77,/oNbCAM3UVJamxRFd5hUt686aqb2.jpg,2022-11-11,Suzume,FALSE,7.986,1019,"Animation,Drama,Adventure,Fantasy",https://www.themoviedb.org/movie/916224
FALSE,/e782pDRAlu4BG0ahd777n8zfPzZ.jpg,en,Guillermo del Toro's Pinocchio,"During the rise of fascism in Mussolini's Italy, a wooden boy brought magically to life struggles to live up to his father's expectations.",56.095,/vx1u0uwxdlhV2MUzj4VlcMB0N6m.jpg,2022-10-22,Guillermo del Toro's Pinocchio,FALSE,8.121,2700,"Animation,Fantasy,Drama,Family",https://www.themoviedb.org/movie/555604
FALSE,/sKvQUSyqsFq8e1ts6oo3Xp3dPH2.jpg,en,Luck,"Suddenly finding herself in the never-before-seen Land of Luck, the unluckiest person in the world must unite with the magical creatures there to turn her luck around.",106.916,/1HOYvwGFioUFL58UVvDRG6beEDm.jpg,2022-08-05,Luck,FALSE,7.808,1584,"Animation,Adventure,Comedy,Fantasy",https://www.themoviedb.org/movie/585511
FALSE,/mzFlwK2WN5KGCgEc4ExJmooJy97.jpg,en,DC League of Super-Pets,"When Superman and the rest of the Justice League are kidnapped, Krypto the Super-Dog must convince a rag-tag shelter pack - Ace the hound, PB the potbellied pig, Merton the turtle and Chip the squirrel - to master their own newfound powers and help him rescue the superheroes.",59.201,/qpPMewlugFaejXjz4YNDnpTniFX.jpg,2022-07-27,DC League of Super-Pets,FALSE,7.288,1443,"Animation,Action,Family,Comedy,Science Fiction",https://www.themoviedb.org/movie/539681
FALSE,/k3wfgR5dRYBtfwisuISJ3H4lgQ0.jpg,ja,ONE PIECE FILM RED,"Uta — the most beloved singer in the world. Her voice, which she sings with while concealing her true identity, has been described as “otherworldly.” She will appear in public for the first time at a live concert. As the venue fills with all kinds of Uta fans — excited pirates, the Navy watching closely, and the Straw Hats led by Luffy who simply came to enjoy her sonorous performance — the voice that the whole world has been waiting for is about to resound.",67.266,/ogDXuVkO92GcETZfSofXXemw7gb.jpg,2022-08-06,One Piece Film Red,FALSE,7.26,854,"Animation,Adventure,Action,Fantasy,Music",https://www.themoviedb.org/movie/900667
FALSE,/uMSxXLfH7v30gRNBqsQaSP3yqX5.jpg,en,Minions: The Rise of Gru,"A fanboy of a supervillain supergroup known as the Vicious 6, Gru hatches a plan to become evil enough to join them, with the backup of his followers, the Minions.",122.023,/wKiOkZTN9lUUUNZLmtnwubZYONg.jpg,2022-06-29,Minions: The Rise of Gru,FALSE,7.343,3302,"Animation,Comedy,Family",https://www.themoviedb.org/movie/438148
FALSE,/wUwizGzbTk5CTiKBnE4Pq1MONwD.jpg,en,The Sea Beast,"In an era when terrifying beasts roamed the seas, monster hunters were celebrated heroes. None were more beloved than the great Jacob Holland. But when young Maisie Brumble stows away on his fabled ship, he's saddled with an unexpected ally. Together they embark on an epic journey into uncharted waters and make history.",58.52,/9Zfv4Ap1e8eKOYnZPtYaWhLkk0d.jpg,2022-06-24,The Sea Beast,FALSE,7.375,1357,"Animation,Adventure,Family,Fantasy",https://www.themoviedb.org/movie/560057
FALSE,/2P3R5sSvPjlbkh4ZnVPqjck0iW5.jpg,ja,ドラゴンボール超 スーパーヒーロー,"The Red Ribbon Army, an evil organization that was once destroyed by Goku in the past, has been reformed by a group of people who have created new and mightier Androids, Gamma 1 and Gamma 2, and seek vengeance against Goku and his family.",123.902,/pi0iZOEHeA3ih4p1IwAG4x2DZNH.jpg,2022-06-11,Dragon Ball Super: Super Hero,FALSE,7.906,2689,"Animation,Science Fiction,Action",https://www.themoviedb.org/movie/610150
FALSE,/nW5fUbldp1DYf2uQ3zJTUdachOu.jpg,en,Lightyear,Legendary Space Ranger Buzz Lightyear embarks on an intergalactic adventure alongside a group of ambitious recruits and his robot companion Sox.,42.81,/b9t3w1loraDh7hjdWmpc9ZsaYns.jpg,2022-06-15,Lightyear,FALSE,7.007,3247,"Animation,Science Fiction,Family,Adventure",https://www.themoviedb.org/movie/718789
FALSE,/qK7Ssnrfvrt65F66A1thvehfQg2.jpg,en,Chip 'n Dale: Rescue Rangers,"Decades since their successful television series was canceled, Chip has succumbed to a life of suburban domesticity as an insurance salesman. Dale, meanwhile, has had CGI surgery and works the nostalgia convention circuit, desperate to relive his glory days. When a former cast mate mysteriously disappears, Chip and Dale must repair their broken friendship and take on their Rescue Rangers detective personas once again to save their friend’s life.",50.25,/7UGmn8TyWPPzkjhLUW58cOUHjPS.jpg,2022-05-20,Chip 'n Dale: Rescue Rangers,FALSE,6.995,1136,"Animation,Family,Comedy,Adventure,Mystery",https://www.themoviedb.org/movie/420821
FALSE,/9IDJpHROaC0S1ZlIxrvzOcOX5yC.jpg,en,The Bad Guys,"When the Bad Guys, a crew of criminal animals, are finally caught after years of heists and being the world’s most-wanted villains, Mr. Wolf brokers a deal to save them all from prison.",71.562,/7qop80YfuO0BwJa1uXk1DXUUEwv.jpg,2022-03-17,The Bad Guys,FALSE,7.571,1848,"Family,Animation,Adventure,Comedy",https://www.themoviedb.org/movie/629542
FALSE,/fOy2Jurz9k6RnJnMUMRDAgBwru2.jpg,en,Turning Red,"Thirteen-year-old Mei is experiencing the awkwardness of being a teenager with a twist – when she gets too excited, she transforms into a giant red panda.",145.779,/qsdjk9oAKSQMWs0Vt5Pyfh6O4GZ.jpg,2022-03-10,Turning Red,FALSE,7.399,4841,"Animation,Family,Comedy,Fantasy",https://www.themoviedb.org/movie/508947
FALSE,/eG0oOQVsniPAuecPzDD1B1gnYWy.jpg,en,The Ice Age Adventures of Buck Wild,The fearless one-eyed weasel Buck teams up with mischievous possum brothers Crash & Eddie as they head off on a new adventure into Buck's home: The Dinosaur World.,76.197,/zzXFM4FKDG7l1ufrAkwQYv2xvnh.jpg,2022-01-28,The Ice Age Adventures of Buck Wild,FALSE,6.636,1630,"Animation,Comedy,Adventure,Family",https://www.themoviedb.org/movie/774825
FALSE,/9SQ0ZLBAcv23D9xJ1nlgTWqDNc5.jpg,en,The House,"Across different eras, a poor family, an anxious developer and a fed-up landlady become tied to the same mysterious house in this animated dark comedy.",33.137,/iZjMFSKCrleKolC1gYcz5Rs8bk1.jpg,2022-01-14,The House,FALSE,7.012,963,"Animation,Drama,Comedy,Horror,Fantasy",https://www.themoviedb.org/movie/926899
FALSE,/ep1urICLqtwwV1sTPHP9WXV4Uto.jpg,en,Hotel Transylvania: Transformania,"When Van Helsing's mysterious invention, the ""Monsterfication Ray,"" goes haywire, Drac and his monster pals are all transformed into humans, and Johnny becomes a monster. In their new mismatched bodies, Drac and Johnny must team up and race across the globe to find a cure before it's too late, and before they drive each other crazy.",118.667,/teCy1egGQa0y8ULJvlrDHQKnxBL.jpg,2022-01-31,Hotel Transylvania: Transformania,FALSE,7.1,2567,"Animation,Comedy,Family,Adventure,Fantasy",https://www.themoviedb.org/movie/585083
FALSE,/5B22eed7ErxFiYAG4Ksb4eLwKNF.jpg,en,Back to the Outback,"Tired of being locked in a reptile house where humans gawk at them like they are monsters, a ragtag group of Australia’s deadliest creatures plot an escape from their zoo to the Outback, a place where they’ll fit in without being judged.",39.099,/jbAUTO7qFN8XFG2LM3bz30vzGFJ.jpg,2021-12-03,Back to the Outback,FALSE,7.741,699,"Family,Animation,Adventure,Comedy",https://www.themoviedb.org/movie/770254
FALSE,/6mJrgL7Mi13XjJeGYJFlD6UEVQw.jpg,en,Sing 2,"Buster and his new cast now have their sights set on debuting a new show at the Crystal Tower Theater in glamorous Redshore City. But with no connections, he and his singers must sneak into the Crystal Entertainment offices, run by the ruthless wolf mogul Jimmy Crystal, where the gang pitches the ridiculous idea of casting the lion rock legend Clay Calloway in their show. Buster must embark on a quest to find the now-isolated Clay and persuade him to return to the stage.",127.48,/aWeKITRFbbwY8txG5uCj4rMCfSP.jpg,2021-12-01,Sing 2,FALSE,7.9,4138,"Animation,Family,Music,Comedy",https://www.themoviedb.org/movie/438695
FALSE,/yqnC3Mp5SL2bpo4bBwtoxyu2E6J.jpg,en,Ciao Alberto,"With his best friend Luca away at school, Alberto is enjoying his new life in Portorosso working alongside Massimo – the imposing, tattooed, one-armed fisherman of few words – who's quite possibly the coolest human in the entire world as far as Alberto is concerned. He wants more than anything to impress his mentor, but it's easier said than done.",23.327,/1SyTnaY0wte69oKdqxQLvxPT3hs.jpg,2021-11-12,Ciao Alberto,FALSE,7.4,640,"Animation,Comedy,Family,Fantasy",https://www.themoviedb.org/movie/876716
FALSE,/1Wlwnhn5sXUIwlxpJgWszT622PS.jpg,en,Clifford the Big Red Dog,"As Emily struggles to fit in at home and at school, she discovers a small red puppy who is destined to become her best friend. When Clifford magically undergoes one heck of a growth spurt, becomes a gigantic dog and attracts the attention of a genetics company, Emily and her Uncle Casey have to fight the forces of greed as they go on the run across New York City. Along the way, Clifford affects the lives of everyone around him and teaches Emily and her uncle the true meaning of acceptance and unconditional love.",51.96,/oifhfVhUcuDjE61V5bS5dfShQrm.jpg,2021-11-10,Clifford the Big Red Dog,FALSE,7.193,1659,"Family,Adventure,Comedy,Fantasy,Animation",https://www.themoviedb.org/movie/585245
FALSE,/3G1Q5xF40HkUBJXxt2DQgQzKTp5.jpg,en,Encanto,"The tale of an extraordinary family, the Madrigals, who live hidden in the mountains of Colombia, in a magical house, in a vibrant town, in a wondrous, charmed place called an Encanto. The magic of the Encanto has blessed every child in the family—every child except one, Mirabel. But when she discovers that the magic surrounding the Encanto is in danger, Mirabel decides that she, the only ordinary Madrigal, might just be her exceptional family's last hope.",141.343,/4j0PNHkMr5ax3IA8tjtxcmPU3QT.jpg,2021-10-13,Encanto,FALSE,7.607,9062,"Animation,Comedy,Family,Fantasy",https://www.themoviedb.org/movie/568124
FALSE,/q4h2ZbhHKhnWvrrqzcjT778zlbn.jpg,en,Injustice,"When Lois Lane is killed, an unhinged Superman decides to take control of the Earth. Determined to stop him, Batman creates a team of freedom-fighting heroes. But when superheroes go to war, can the world survive?",37.307,/rzrSeqqpm1BwJ3tcTznztBtLLSD.jpg,2021-10-09,Injustice,FALSE,7.42,742,"Animation,Science Fiction,Fantasy,Action",https://www.themoviedb.org/movie/831405
FALSE,/sdL37sfUBth7mdkAolI83bXAl7L.jpg,en,Ron's Gone Wrong,"In a world where walking, talking, digitally connected bots have become children's best friends, an 11-year-old finds that his robot buddy doesn't quite work the same as the others do.",39.632,/plzgQAXIEHm4Y92ktxU6fedUc0x.jpg,2021-10-14,Ron's Gone Wrong,FALSE,7.933,1737,"Animation,Science Fiction,Family,Comedy",https://www.themoviedb.org/movie/482321
FALSE,/9e6wp707XMouPG939o2fHunXXJR.jpg,en,The Addams Family 2,The Addams get tangled up in more wacky adventures and find themselves involved in hilarious run-ins with all sorts of unsuspecting characters.,48.56,/ld7YB9vBRp1GM1DT3KmFWSmtBPB.jpg,2021-10-01,The Addams Family 2,FALSE,7.017,1214,"Family,Animation,Comedy,Fantasy,Adventure",https://www.themoviedb.org/movie/639721
FALSE,/orGlr1vHTgbDkGJPwuBjd8ncVjQ.jpg,en,The Witcher: Nightmare of the Wolf,"Escaping from poverty to become a witcher, Vesemir slays monsters for coin and glory, but when a new menace rises, he must face the demons of his past.",34.876,/3sLz2yv6vBDWqBbd8rdnNeoJ2kJ.jpg,2021-08-23,The Witcher: Nightmare of the Wolf,FALSE,7.523,884,"Animation,Action,Fantasy",https://www.themoviedb.org/movie/666243
FALSE,/a17F3zXnmuwqxfiDa46mtlosjrv.jpg,en,PAW Patrol: The Movie,Ryder and the pups are called to Adventure City to stop Mayor Humdinger from turning the bustling metropolis into a state of chaos.,97.456,/ic0intvXZSfBlYPIvWXpU1ivUCO.jpg,2021-08-09,PAW Patrol: The Movie,FALSE,7.411,1187,"Animation,Family,Adventure,Comedy",https://www.themoviedb.org/movie/675445
FALSE,/2BftdeCkD7uf68KUxaKRBxtsmZZ.jpg,en,Vivo,A music-loving kinkajou named Vivo embarks on the journey of a lifetime to fulfill his destiny and deliver a love song for an old friend.,36.091,/eRLlrhbdYE7XN6VtcZKy6o2BsOw.jpg,2021-07-30,Vivo,FALSE,7.312,674,"Animation,Family,Comedy",https://www.themoviedb.org/movie/449406
FALSE,/LOpxRdlb4oLiQIoVhLYbdBSc3U.jpg,ja,竜とそばかすの姫,"Suzu is a 17-year-old high-school student living in a rural town with her father. Wounded by the loss of her mother at a young age, Suzu one day discovers the massive online world ""U"" and dives into this alternate reality as her avatar, Belle. Before long, all of U's eyes are fixed on Belle, when, suddenly, a mysterious, dragon-like figure appears before her.",39.362,/fYHOD4pxZQk4rsP2tQrZI5uBlZV.jpg,2021-07-16,Belle,FALSE,7.737,675,"Animation,Science Fiction,Family",https://www.themoviedb.org/movie/776305
FALSE,/jBUukLTCmXL79itbmK5JtQvImYS.jpg,en,"The Simpsons: The Good, the Bart, and the Loki",Loki is banished from Asgard once again and must face his toughest opponents yet: the Simpsons and Springfield’s mightiest heroes. The God of Mischief teams up with Bart Simpson in the ultimate crossover event paying tribute to the Marvel Cinematic Universe of superheroes and villains.,43.594,/rtMdtzywcAGOrF6t8fbxJBqpdcq.jpg,2021-07-07,"The Simpsons: The Good, the Bart, and the Loki",FALSE,7.312,642,"Animation,Comedy,Family",https://www.themoviedb.org/movie/846214
FALSE,/8s4h9friP6Ci3adRGahHARVd76E.jpg,en,Space Jam: A New Legacy,"When LeBron and his young son Dom are trapped in a digital space by a rogue A.I., LeBron must get them home safe by leading Bugs, Lola Bunny and the whole gang of notoriously undisciplined Looney Tunes to victory over the A.I.'s digitized champions on the court. It's Tunes versus Goons in the highest-stakes challenge of his life.",83.714,/5bFK5d3mVTAvBCXi5NPWH0tYjKl.jpg,2021-07-08,Space Jam: A New Legacy,FALSE,6.78,3841,"Family,Animation,Comedy,Science Fiction",https://www.themoviedb.org/movie/379686
FALSE,/yBov7O4eXDcBLDpZrOHZzFr8rIl.jpg,en,The Boss Baby: Family Business,The Templeton brothers — Tim and his Boss Baby little bro Ted — have become adults and drifted away from each other. But a new boss baby with a cutting-edge approach and a can-do attitude is about to bring them together again … and inspire a new family business.,85.402,/kv2Qk9MKFFQo4WQPaYta599HkJP.jpg,2021-07-01,The Boss Baby: Family Business,FALSE,7.397,2416,"Animation,Comedy,Adventure,Family",https://www.themoviedb.org/movie/459151
