adult,backdrop_path,original_language,original_title,overview,popularity,poster_path,release_date,title,video,vote_average,vote_count,genres,tmdbUrl
FALSE,/5tub2Kw6NboWFblA1CgDEwB59jP.jpg,en,Big Hero 6,"A special bond develops between plus-sized inflatable robot Baymax, and prodigy Hiro Hamada, who team up with a group of friends to form a band of high-tech heroes.",137.038,/2mxS4wUimwlLmI1xp6QW6NSU361.jpg,2014-10-24,Big Hero 6,FALSE,7.735,15098,"Adventure,Family,Animation,Action,Comedy",https://www.themoviedb.org/movie/177572
FALSE,/uRupYPNqCE61kmRSKIGQxWWIaBP.jpg,en,Lava,"Inspired by the isolated beauty of tropical islands and the explosive allure of ocean volcanoes, Lava is a musical love story that takes place over millions of years.",11.57,/n7C5rbdwEsVGdzBTayjjhavB8b9.jpg,2014-10-10,Lava,FALSE,7.272,1030,"Animation,Family",https://www.themoviedb.org/movie/286192
FALSE,/nlG452icactoT6hbqECbSEVfGII.jpg,en,The Book of Life,"The journey of Manolo, a young man who is torn between fulfilling the expectations of his family and following his heart. Before choosing which path to follow, he embarks on an incredible adventure that spans three fantastical worlds where he must face his greatest fears.",46.964,/aotTZos5KswgCryEzx2rlOjFsm1.jpg,2014-10-01,The Book of Life,FALSE,7.542,2545,"Animation,Adventure,Comedy,Family,Fantasy",https://www.themoviedb.org/movie/228326
FALSE,/AaIRBsx4hpa2fVQzeCfFyOdzCEM.jpg,en,Song of the Sea,"The story of the last Seal Child’s journey home. After their mother’s disappearance, Ben and Saoirse are sent to live with Granny in the city. When they resolve to return to their home by the sea, their journey becomes a race against time as they are drawn into a world Ben knows only from his mother’s folktales. But this is no bedtime story; these fairy folk have been in our world far too long. It soon becomes clear to Ben that Saoirse is the key to their survival.",21.543,/3DBX7QOEzWPNcDhqXInk6GBEvhK.jpg,2014-09-06,Song of the Sea,FALSE,8.003,1356,"Family,Animation,Fantasy",https://www.themoviedb.org/movie/110416
FALSE,/dkBx0XNzsngDDqiWiPG08eMWBm7.jpg,en,The Boxtrolls,"An orphaned boy raised by underground creatures called Boxtrolls comes up from the sewers and out of his box to save his family and the town from the evil exterminator, Archibald Snatcher.",26.476,/xDw2kqSDsYneL3g9OIpExPfqpHJ.jpg,2014-09-10,The Boxtrolls,FALSE,6.665,1595,"Animation,Comedy,Family,Fantasy",https://www.themoviedb.org/movie/170687
FALSE,/9AciCs5rFHvFbCIqThfq281sUOw.jpg,en,Batman: Assault on Arkham,Batman works desperately to find a bomb planted by the Joker while Amanda Waller sends her newly-formed Suicide Squad to break into Arkham Asylum and recover vital information stolen by the Riddler.,36.063,/b9KxvIAZkl2f57kjObj8Z9z9LhL.jpg,2014-08-12,Batman: Assault on Arkham,FALSE,7.312,1058,"Thriller,Animation,Action,Crime",https://www.themoviedb.org/movie/242643
FALSE,/86l1gqKjhPn6Ypd8XSSIGx7ZikB.jpg,ja,思い出のマーニー,"Upon being sent to live with relatives in the countryside due to an illness, an emotionally distant adolescent girl becomes obsessed with an abandoned mansion and infatuated with a girl who lives there - a girl who may or may not be real.",54.074,/at7lShVfMdohEzC1VZYTZXY0hzP.jpg,2014-07-19,When Marnie Was There,FALSE,7.94,1697,"Animation,Drama",https://www.themoviedb.org/movie/242828
FALSE,/9GRprCMQOWJzczPxqAaGxYft5m9.jpg,en,Planes: Fire & Rescue,"When world-famous air racer Dusty learns that his engine is damaged and he may never race again, he must shift gears and is launched into the world of aerial firefighting. Dusty joins forces with veteran fire and rescue helicopter Blade Ranger and his team, a bunch of all-terrain vehicles known as The Smokejumpers. Together, the fearless team battles a massive wildfire, and Dusty learns what it takes to become a true hero.",78.348,/pOmteFeBDI9FJOPTDvYJYFeAtdp.jpg,2014-07-17,Planes: Fire & Rescue,FALSE,6.156,802,"Animation,Comedy,Adventure,Family",https://www.themoviedb.org/movie/218836
FALSE,/odBSDNyi5J6Sed2Xu3QKTtEAIzN.jpg,ja,聖闘士星矢 LEGEND of SANCTUARY,"Warriors called ""Saints"" are the champions of hope who have always appeared since the Age of Myth whenever evil threatens the world. In this present day story, many years since the long fought ""Holy War"" we find Saori Kido, a girl troubled by her mysterious powers. She is saved by a boy, Seiya ""Bronze Saint"" from a sudden attack by an assassin, through the accident Saori realizes her destiny and mission and decides to go to ""Sanctuary"" with Seiya and his company of Bronze Saints. In Sanctuary they confront ""Pope"" and wage a desperate battle against the greatest Saints, the ""Gold Saints"".",40.6,/gxKfP9278RK4t3J8vLXoFfB8ihl.jpg,2014-06-21,Saint Seiya: Legend of Sanctuary,FALSE,6.563,652,"Action,Animation,Fantasy",https://www.themoviedb.org/movie/287590
FALSE,/2xyyn4Rc9kbkaojG9am1FInCmxr.jpg,en,Feast,"This Oscar-winning animated short film tells the story of one man's love life as seen through the eyes of his best friend and dog, Winston, and revealed bite by bite through the meals they share.",14.312,/6hAgSxgd2YIK5pYhwowtnlGpwbe.jpg,2014-10-25,Feast,FALSE,7.839,822,"Animation,Comedy,Drama,Family",https://www.themoviedb.org/movie/293299
FALSE,/5MnP0h7RcUCeX7gpxMYoMScmfq7.jpg,en,How to Train Your Dragon 2,"Five years have passed since Hiccup and Toothless united the dragons and Vikings of Berk. Now, they spend their time charting unmapped territories. During one of their adventures, the pair discover a secret cave that houses hundreds of wild dragons -- and a mysterious dragon rider who turns out to be Hiccup's mother, Valka. Hiccup and Toothless then find themselves at the center of a battle to protect Berk from a power-hungry warrior named Drago.",86.578,/d13Uj86LdbDLrfDoHR5aDOFYyJC.jpg,2014-06-05,How to Train Your Dragon 2,FALSE,7.669,9196,"Fantasy,Action,Adventure,Animation,Comedy,Family",https://www.themoviedb.org/movie/82702
FALSE,/jYqOnJDPI7QD9cGbE6CwDTp1tID.jpg,en,Son of Batman,"Batman learns he has a violent, unruly pre-teen son, secretly raised by the terrorist group known as The League of Assassins.",23.633,/yHx8OLSKc3VtIBB5lIe90c0fHOX.jpg,2014-05-13,Son of Batman,FALSE,7.042,1003,"Animation,Action,Adventure",https://www.themoviedb.org/movie/251519
FALSE,/eg2jxQ1FFi6ENDfyMIMC5odpcU0.jpg,en,Rio 2,"It's a jungle out there for Blu, Jewel and their three kids after they're hurtled from Rio de Janeiro to the wilds of the Amazon. As Blu tries to fit in, he goes beak-to-beak with the vengeful Nigel, and meets the most fearsome adversary of all: his father-in-law.",62.782,/gVNTBrjxh2YRmQFjlaqrNbHVvrd.jpg,2014-03-19,Rio 2,FALSE,6.511,3327,"Animation,Adventure,Comedy,Family",https://www.themoviedb.org/movie/172385
FALSE,/iOUwya0vGQ6ApDZ8Ar3KUyeFOkQ.jpg,en,Tinker Bell and the Pirate Fairy,"Zarina, a smart and ambitious dust-keeper fairy who’s captivated by Blue Pixie Dust and its endless possibilities, flees Pixie Hollow and joins forces with the scheming pirates of Skull Rock, who make her captain of their ship. Tinker Bell and her friends must embark on an epic adventure to find Zarina, and together they go sword-to-sword with the band of pirates led by a cabin boy named James, who’ll soon be known as Captain Hook himself.",62.104,/fbKMx3taGom2ASpbLKtglW3XT87.jpg,2014-02-13,Tinker Bell and the Pirate Fairy,FALSE,6.917,941,"Animation,Family",https://www.themoviedb.org/movie/175112
FALSE,/lkBwfDDgLw1giIdmJCbVObkTzFr.jpg,en,Mr. Peabody & Sherman,"A young boy and his dog, who happens to have a genius-level IQ, spring into action when their time-machine is stolen and moments in history begin to be changed.",42.593,/c6kZC5pvwNIRSxiLL2JFGGc46He.jpg,2014-02-07,Mr. Peabody & Sherman,FALSE,6.717,2250,"Animation,Adventure,Family",https://www.themoviedb.org/movie/82703
FALSE,/5N2mfRrvJUnCVpsMIebfosEyo1i.jpg,en,The Lego Movie,"An ordinary Lego mini-figure, mistakenly thought to be the extraordinary MasterBuilder, is recruited to join a quest to stop an evil Lego tyrant from conquering the universe.",63.383,/9klB7qKC9aCeGyyM4uU5hSA6xDV.jpg,2014-02-06,The Lego Movie,FALSE,7.4,7484,"Animation,Family,Adventure,Comedy,Fantasy",https://www.themoviedb.org/movie/137106
FALSE,/uD6AG36ykWAwKfSrLBuaVmpRC0.jpg,en,Justice League: War,"The world is under attack by an alien armada led by the powerful Apokoliptian, Darkseid. A group of superheroes consisting of Superman, Batman, Wonder Woman, The Flash, Green Lantern, Cyborg, and Shazam must set aside their differences and gather together to defend Earth.",28.14,/pdNprWYdgcB8z4FLD3BhRmhEys1.jpg,2014-01-21,Justice League: War,FALSE,7.421,1023,"Animation,Action",https://www.themoviedb.org/movie/217993
FALSE,/ou3C0RoC298XoR0wqnDKJeOV0uX.jpg,en,The Nut Job,"Surly, a curmudgeon, independent squirrel is banished from his park and forced to survive in the city. Lucky for him, he stumbles on the one thing that may be able to save his life, and the rest of park community, as they gear up for winter - Maury's Nut Store.",30.134,/4iHnGlmOjAj2k5zUftYDIzSITCf.jpg,2014-01-17,The Nut Job,FALSE,5.751,897,"Animation,Comedy,Family,Adventure",https://www.themoviedb.org/movie/227783
FALSE,/vwmYKEGk8exXrusBv2EhXcoW64D.jpg,fr,Jack et la mécanique du cœur,"In Scotland 1874, Jack is born on the coldest day ever. Because of the extreme cold, his heart stops beating. The responsible midwife in Edinburgh finds a way to save him by replacing his heart with a clock. So he lives and remains under the midwife's protective care. But he must not get angry or excited because that endangers his life by causing his clock to stop working. Worse than that, when he grows up, he has to face the fact he cannot fall in love because that too could stop his delicate heart.",16.722,/ZSrU2mvlzM5Jr30XtKCU1fziIj.jpg,2014-02-05,Jack and the Cuckoo-Clock Heart,FALSE,7.208,679,"Animation,Romance,Adventure,Drama,Fantasy",https://www.themoviedb.org/movie/204436
FALSE,/imUJOrtNf8EWameChpaRLXSaX4w.jpg,ja,かぐや姫の物語,"Found inside a shining stalk of bamboo by an old bamboo cutter and his wife, a tiny girl grows rapidly into an exquisite young lady. The mysterious young princess enthrals all who encounter her. But, ultimately, she must confront her fate.",41.475,/cQidJuA546OSSXKWXoiCeINDxuj.jpg,2013-11-23,The Tale of The Princess Kaguya,FALSE,8.073,1659,"Animation,Drama,Fantasy",https://www.themoviedb.org/movie/149871
FALSE,/fydUcbkqLyESCFa9U5XKqi8dIVj.jpg,en,Frozen,"Young princess Anna of Arendelle dreams about finding true love at her sister Elsa’s coronation. Fate takes her on a dangerous journey in an attempt to end the eternal winter that has fallen over the kingdom. She's accompanied by ice delivery man Kristoff, his reindeer Sven, and snowman Olaf. On an adventure where she will find out what friendship, courage, family, and true love really means.",99.925,/kgwjIb2JDHRhNk13lmSxiClFjVk.jpg,2013-11-20,Frozen,FALSE,7.247,15951,"Animation,Family,Adventure,Fantasy",https://www.themoviedb.org/movie/109445
FALSE,/wwQPd2FSqPKm4clJY4bWfs4lYj4.jpg,en,Free Birds,Two turkeys from opposite sides of the tracks must put aside their differences and team up to travel back in time to change the course of history—and get turkey off the holiday menu for good.,23.153,/k8iqk6we3QbkAKrtQweaLtNe3R0.jpg,2013-10-30,Free Birds,FALSE,5.854,736,"Animation,Comedy,Family",https://www.themoviedb.org/movie/175574
FALSE,/7KiBr9MNqcNNJKj6FkEGfNHSAsH.jpg,en,Tarzan,"One of the most classic and revered stories of all time, Edgar Rice Burroughs' Tarzan returns to the big screen for a new generation. Tarzan and Jane face a mercenary army dispatched by the evil CEO of Greystoke Energies, a man who took over the company from Tarzan's parents, after they died in a plane crash in the African jungle.",26.123,/wIg7TclH6PUcvTWFh0QdtU5Wcvt.jpg,2013-10-17,Tarzan,FALSE,5.668,569,"Animation,Action,Adventure,Family",https://www.themoviedb.org/movie/230222
FALSE,/9S2Id7rzj5B9MEI1CnpUHnf24cS.jpg,en,Toy Story of Terror!,"What starts out as a fun road trip for the Toy Story gang takes an unexpected turn for the worse when the trip detours to a roadside motel. After one of the toys goes missing, the others find themselves caught up in a mysterious sequence of events that must be solved before they all suffer the same fate in this Toy Story of Terror.",1.171,/oPBEnNP4Fg4gv9c0KBhchmtoG4H.jpg,2013-10-16,Toy Story of Terror!,FALSE,7.184,887,"Adventure,Animation,Comedy,Family",https://www.themoviedb.org/movie/213121
FALSE,/vWriOBVlgW0XWdgbOiijhyLW7B8.jpg,en,Cloudy with a Chance of Meatballs 2,"After the disastrous food storm in the first film, Flint and his friends are forced to leave the town. Flint accepts the invitation from his idol Chester V to join The Live Corp Company, which has been tasked to clean the island, and where the best inventors in the world create technologies for the betterment of mankind. When Flint discovers that his machine still operates and now creates mutant food beasts like living pickles, hungry tacodiles, shrimpanzees and apple pie-thons, he and his friends must return to save the world.",63.003,/tT2DN1tWk1zpCxqvaaNY8yP8Awn.jpg,2013-09-26,Cloudy with a Chance of Meatballs 2,FALSE,6.431,3002,"Animation,Family,Comedy",https://www.themoviedb.org/movie/109451
FALSE,/4xzUhKxWHxPjJ6h1faVMTUBDquQ.jpg,ja,キャプテンハーロック,Space Pirate Captain Harlock and his fearless crew face off against the space invaders who seek to conquer the planet Earth.,33.697,/fnoZJlitIOBo2fSCyzAsv0lHtYL.jpg,2013-09-07,Space Pirate Captain Harlock,FALSE,6.609,984,"Animation,Science Fiction",https://www.themoviedb.org/movie/192577
FALSE,/1BaUaXBRKzwNESZ6hZkZjelatmt.jpg,en,Planes,"Dusty is a cropdusting plane who dreams of competing in a famous aerial race. The problem? He is hopelessly afraid of heights. With the support of his mentor Skipper and a host of new friends, Dusty sets off to make his dreams come true.",34.558,/i2xgU0y0p77WTrB0oIkbpdaWq8R.jpg,2013-08-09,Planes,FALSE,5.88,1600,"Animation,Family,Adventure,Comedy",https://www.themoviedb.org/movie/151960
FALSE,/y41qhCHR7bC0HTg5bdxaegbRCKg.jpg,en,Justice League: The Flashpoint Paradox,The Flash finds himself in a war-torn alternate timeline and teams up with alternate versions of his fellow heroes to restore the timeline.,27.493,/f8YdytKsjIse0kmWxKlpczOugld.jpg,2013-07-30,Justice League: The Flashpoint Paradox,FALSE,7.888,1748,"Science Fiction,Animation,Action,Adventure",https://www.themoviedb.org/movie/183011
FALSE,/aIyvMthA7UGV6ix6AUUM88ZXfeU.jpg,en,The Smurfs 2,"The evil wizard Gargamel creates a couple of mischievous Smurf-like creatures called the Naughties that he hopes will let him harness the all-powerful, magical Smurf-essence. But when he discovers that only a real Smurf can give him what he wants, and only a secret spell that Smurfette knows can turn the Naughties into real Smurfs, Gargamel kidnaps Smurfette and brings her to Paris, where he has been winning the adoration of millions as the world¹s greatest sorcerer. It's up to Papa, Clumsy, Grouchy, and Vanity to return to our world, reunite with their human friends Patrick and Grace Winslow, and rescue her! Will Smurfette, who has always felt different from the other Smurfs, find a new connection with the Naughties Vexy and Hackus or will the Smurfs convince her that their love for her is True Blue?",36.779,/tmjvgbEH4BKYFfHmWXjXrHgi8wT.jpg,2013-07-30,The Smurfs 2,FALSE,5.763,2099,"Fantasy,Family,Comedy,Animation",https://www.themoviedb.org/movie/77931
FALSE,/938lqhAQaO3hmLg44VbUR7OqlMs.jpg,ja,風立ちぬ,"A lifelong love of flight inspires Japanese aviation engineer Jiro Horikoshi, whose storied career includes the creation of the A-6M World War II fighter plane.",55.597,/jfwSexzlIzaOgxP9A8bTA6t8YYb.jpg,2013-07-20,The Wind Rises,FALSE,7.781,2819,"Drama,Animation,Romance,War",https://www.themoviedb.org/movie/149870
FALSE,/dxmp5eHarPlNyeRyuzD6oMWqTjs.jpg,en,Turbo,The tale of an ordinary garden snail who dreams of winning the Indy 500.,42.475,/aE3A98CfBWVReurJqpOBFbzIwMf.jpg,2013-07-11,Turbo,FALSE,6.194,3164,"Animation,Family",https://www.themoviedb.org/movie/77950
FALSE,/fOipappvgVtUbbHOtmCkHzcwJjC.jpg,en,Despicable Me 2,Gru is recruited by the Anti-Villain League to help deal with a powerful new super criminal.,89.571,/5Fh4NdoEnCjCK9wLjdJ9DJNFl2b.jpg,2013-06-26,Despicable Me 2,FALSE,6.92,10789,"Animation,Comedy,Family",https://www.themoviedb.org/movie/93456
FALSE,/pK42lGbT48fClhtEcP7gvk4hoXP.jpg,en,Monsters University,A look at the relationship between Mike and Sulley during their days at Monsters University — when they weren't necessarily the best of friends.,76.72,/y7thwJ7z5Bplv6vwl6RI0yteaDD.jpg,2013-06-19,Monsters University,FALSE,7.031,10179,"Animation,Family",https://www.themoviedb.org/movie/62211
FALSE,/lQ95iwZt1ZdDuDhB0rpFZPgFCBu.jpg,en,Epic,A teenager finds herself transported to a deep forest setting where a battle between the forces of good and the forces of evil is taking place. She bands together with a rag-tag group characters in order to save their world—and ours.,45.369,/81cSsWzjTfR3cJSqnTiHwy1eyPK.jpg,2013-05-15,Epic,FALSE,6.492,2596,"Animation,Adventure,Family,Fantasy",https://www.themoviedb.org/movie/116711
FALSE,/qMNmdJG0WFNXcI6hfZMQH0geHc5.jpg,ja,言の葉の庭,"Takao, who is training to become a shoemaker, skipped school and is sketching shoes in a Japanese-style garden. He meets a mysterious woman, Yukino, who is older than him. Then, without arranging the times, the two start to see each other again and again, but only on rainy days. They deepen their relationship and open up to each other. But the end of the rainy season soon approaches.",30.847,/mXUCVq3HMtS4Y9IQ8vmEOPyN0vH.jpg,2013-05-31,The Garden of Words,FALSE,7.571,1906,"Animation,Drama,Romance",https://www.themoviedb.org/movie/198375
FALSE,/pWNUpRESGnzKqweHCB77JShPZ2i.jpg,ja,ドラゴンボールZ 神と神,"The events of Battle of Gods take place some years after the battle with Majin Buu, which determined the fate of the entire universe. After awakening from a long slumber, Beerus, the God of Destruction is visited by Whis, his attendant and learns that the galactic overlord Frieza has been defeated by a Super Saiyan from the North Quadrant of the universe named Goku, who is also a former student of the North Kai. Ecstatic over the new challenge, Goku ignores King Kai's advice and battles Beerus, but he is easily overwhelmed and defeated. Beerus leaves, but his eerie remark of ""Is there nobody on Earth more worthy to destroy?"" lingers on. Now it is up to the heroes to stop the God of Destruction before all is lost.",114.728,/nxZEdYcHMuD8SSuwusDnK9CD2H1.jpg,2013-03-30,Dragon Ball Z: Battle of Gods,FALSE,6.776,1451,"Animation,Action,Science Fiction",https://www.themoviedb.org/movie/126963
FALSE,/bNgqt819qpHcszjCzLCG5y16ldF.jpg,en,The Croods,"The prehistoric Croods family live in a particularly dangerous moment in time. Patriarch Grug, his mate Ugga, teenage daughter Eep, son Thunk, and feisty Gran gather food by day and huddle together in a cave at night. When a more evolved caveman named Guy arrives on the scene, Grug is distrustful, but it soon becomes apparent that Guy is correct about the impending destruction of their world.",50.534,/w8I8f3oWtUNB6X79A2oApKQkRet.jpg,2013-03-15,The Croods,FALSE,6.91,6796,"Animation,Adventure,Family,Fantasy,Comedy,Action",https://www.themoviedb.org/movie/49519
FALSE,/dlReM2zDrOfkvrJj9R96XmhNdS4.jpg,en,Escape from Planet Earth,Astronaut Scorch Supernova finds himself caught in a trap when he responds to an SOS from a notoriously dangerous alien planet.,32.082,/tkkLIeompowyXFZFe3sBmhm3wwA.jpg,2013-02-14,Escape from Planet Earth,FALSE,5.729,714,"Animation,Comedy,Adventure,Family,Science Fiction",https://www.themoviedb.org/movie/68179
FALSE,/4nQMxOfOYP4cYI69XRt9Gm1jA2E.jpg,en,The Blue Umbrella,"It is just another evening commute until the rain starts to fall, and the city comes alive to the sound of dripping rain pipes, whistling awnings and gurgling gutters.",10.625,/iSWV7ra8HJ3gYnZFMMrPe8CBbrv.jpg,2013-02-12,The Blue Umbrella,FALSE,7.538,525,"Animation,Romance",https://www.themoviedb.org/movie/200481
FALSE,/9Eh5xzWTpJeZM1FGCblWKZ8GTpw.jpg,en,"Batman: The Dark Knight Returns, Part 2",Batman has stopped the reign of terror that The Mutants had cast upon his city.  Now an old foe wants a reunion and the government wants The Man of Steel to put a stop to Batman.,41.518,/arEZYd6uMOFTILne9Ux0A8qctMe.jpg,2013-01-03,"Batman: The Dark Knight Returns, Part 2",FALSE,7.92,1392,"Science Fiction,Action,Animation,Mystery",https://www.themoviedb.org/movie/142061
FALSE,/6zvLHD4rbHUNuRQLoIC2rkV8ayi.jpg,fr,Ernest et Célestine,"Celestine is a little mouse trying to avoid a dental career while Ernest is a big bear craving an artistic outlet. When Celestine meets Ernest, they overcome their natural enmity by forging a life of crime together.",14.786,/iJPbRASktYW0I009Ktc2zUE6Fvg.jpg,2012-12-12,Ernest & Celestine,FALSE,7.8,568,"Animation,Comedy,Drama,Family,Adventure",https://www.themoviedb.org/movie/126319
FALSE,/46IGtYNjpIvQYRIQlb2X493Wh8x.jpg,en,Rise of the Guardians,"When an evil spirit known as Pitch lays down the gauntlet to take over the world, the immortal Guardians must join forces for the first time to protect the hopes, beliefs and imagination of children all over the world.",60.974,/sW4qOa9yF0Ikg7lppncQ0n5UhKX.jpg,2012-11-21,Rise of the Guardians,FALSE,7.4,6441,"Family,Animation,Fantasy,Action,Adventure",https://www.themoviedb.org/movie/81188
FALSE,/c5WUWudgykIpxb3TchaRnAcsu5y.jpg,ja,ヱヴァンゲリヲン新劇場版:Q,"Fourteen years after Third Impact, Shinji Ikari awakens to a world he does not remember. He hasn't aged. Much of Earth is laid in ruins, NERV has been dismantled, and people who he once protected have turned against him. Befriending the enigmatic Kaworu Nagisa, Shinji continues the fight against the angels and realizes the fighting is far from over, even when it could be against his former allies. The characters' struggles continue amidst the battles against the angels and each other, spiraling down to what could inevitably be the end of the world.",33.735,/d0s1xvykzl0kz7fP5S2ROYqphdz.jpg,2012-11-17,Evangelion: 3.0 You Can (Not) Redo,FALSE,7.24,761,"Animation,Science Fiction,Action,Drama",https://www.themoviedb.org/movie/75629
FALSE,/ziC23LkMYj8gToQQYQGWSGJCLNF.jpg,en,Wreck-It Ralph,"Wreck-It Ralph is the 9-foot-tall, 643-pound villain of an arcade video game named Fix-It Felix Jr., in which the game's titular hero fixes buildings that Ralph destroys. Wanting to prove he can be a good guy and not just a villain, Ralph escapes his game and lands in Hero's Duty, a first-person shooter where he helps the game's hero battle against alien invaders. He later enters Sugar Rush, a kart racing game set on tracks made of candies, cookies and other sweets. There, Ralph meets Vanellope von Schweetz who has learned that her game is faced with a dire threat that could affect the entire arcade, and one that Ralph may have inadvertently started.",89.045,/zWoIgZ7mgmPkaZjG0102BSKFIqQ.jpg,2012-11-01,Wreck-It Ralph,FALSE,7.336,11855,"Family,Animation,Comedy,Adventure",https://www.themoviedb.org/movie/82690
FALSE,/yfTZ2MSRWc06cBrFOsAF4Lebi4.jpg,en,Frankenweenie,"When a car hits young Victor's pet dog Sparky, Victor decides to bring him back to life the only way he knows how. But when the bolt-necked ""monster"" wreaks havoc and terror in the hearts of Victor's neighbors, he has to convince them that Sparky's still the good, loyal friend he was.",26.838,/yGjVbLVdZRBlZTTQVBsj2KUjL1s.jpg,2012-10-04,Frankenweenie,FALSE,6.957,3155,"Animation,Comedy,Family",https://www.themoviedb.org/movie/62214
FALSE,/kCQKdkfNc7Smox53QRalBO3Doe0.jpg,en,Barbie: The Princess & The Popstar,"Tori is a blonde princess who is bored of living her royal life, and has dreams of becoming a popstar. Keira, on the other hand, is a brunette popstar who dreams of being a princess. When the two meet, they magically trade places, but after realising it is best to be themselves.",27.134,/hab6ZMC3eXj9pQHlSxNUjonphCR.jpg,2012-09-13,Barbie: The Princess & The Popstar,FALSE,7.129,567,"Family,Animation",https://www.themoviedb.org/movie/129533
FALSE,/5rARlA8beRAVXPYzSaF2NoS8Ry5.jpg,en,Hotel Transylvania,"Welcome to Hotel Transylvania, Dracula's lavish five-stake resort, where monsters and their families can live it up and no humans are allowed. One special weekend, Dracula has invited all his best friends to celebrate his beloved daughter Mavis's 118th birthday. For Dracula catering to all of these legendary monsters is no problem but the party really starts when one ordinary guy stumbles into the hotel and changes everything!",65.136,/eJGvzGrsfe2sqTUPv5IwLWXjVuR.jpg,2012-09-20,Hotel Transylvania,FALSE,6.955,8262,"Animation,Comedy,Family,Fantasy",https://www.themoviedb.org/movie/76492
FALSE,/1YaG52CwGY3pKh76OBlwX0ymncg.jpg,en,"Batman: The Dark Knight Returns, Part 1","Batman has not been seen for ten years. A new breed of criminal ravages Gotham City, forcing 55-year-old Bruce Wayne back into the cape and cowl. But, does he still have what it takes to fight crime in a new era?",29.826,/kkjTbwV1Xnj8wBL52PjOcXzTbnb.jpg,2012-08-21,"Batman: The Dark Knight Returns, Part 1",FALSE,7.729,1508,"Science Fiction,Action,Animation,Mystery",https://www.themoviedb.org/movie/123025
FALSE,/wBhCoNBvQhAbH6xwRFs0ZcbUESS.jpg,en,Secret of the Wings,Tinkerbell wanders into the forbidden Winter woods and meets Periwinkle. Together they learn the secret of their wings and try to unite the warm fairies and the winter fairies to help Pixie Hollow.,65.152,/bnbzEKX9LgDuJ0VBGm5d60mKDaR.jpg,2012-08-17,Secret of the Wings,FALSE,7.22,1153,"Animation,Family,Fantasy,Adventure",https://www.themoviedb.org/movie/75258
