adult,backdrop_path,original_language,original_title,overview,popularity,poster_path,release_date,title,video,vote_average,vote_count,genres,tmdbUrl
FALSE,/vKcfBoytFRa3kgaHWQdxew8nm71.jpg,en,The Little Mermaid: Ariel's Beginning,"Follow Ariel's adventures before she gave up her fins for true love. When Ariel wasn't singing with her sisters, she spent time with her mother, Queen Athena. Ariel is devastated when Athena is killed by pirates, and after King Triton outlaws all singing. Along with pals Flounder and Sebastian, Ariel sets off in hopes of changing her father's decision to ban music from the kingdom.",2.866,/LJs21HQ7foXB37tDI0JiGkuEAC.jpg,2008-08-25,The Little Mermaid: Ariel's Beginning,FALSE,6.711,970,"Family,Animation",https://www.themoviedb.org/movie/13676
FALSE,/eVA4ztLIuPEsokkgQ3NRt9rTRVh.jpg,en,Star Wars: The Clone Wars,"As the Clone Wars sweep through the galaxy, the heroic Jedi Knights struggle to maintain order and restore peace. More and more systems are falling prey to the forces of the dark side as the Galactic Republic slips further and further under the sway of the Separatists and their never-ending droid army. Anakin Skywalker and his Padawan learner Ahsoka Tano find themselves on a mission with far-reaching consequences, one that brings them face-to-face with crime lord Jabba the Hutt. But Count Dooku and his sinister agents, including the nefarious Asajj Ventress, will stop at nothing to ensure that Anakin and Ahsoka fail at their quest. Meanwhile, on the front lines of the Clone Wars, Obi-Wan Kenobi and Master Yoda lead the massive clone army in a valiant effort to resist the forces of the dark side...",27.289,/iJQfixW818LUdSXlCDL3JZm0S0g.jpg,2008-08-05,Star Wars: The Clone Wars,FALSE,6.109,1903,"Animation,Action,Science Fiction,Adventure",https://www.themoviedb.org/movie/12180
FALSE,/shqLeIkqPAAXM8iT6wVDiXUYz1p.jpg,ja,崖の上のポニョ,"When Sosuke, a young boy who lives on a clifftop overlooking the sea, rescues a stranded goldfish named Ponyo, he discovers more than he bargained for. Ponyo is a curious, energetic young creature who yearns to be human, but even as she causes chaos around the house, her father, a powerful sorcerer, schemes to return Ponyo to the sea.",76.192,/yp8vEZflGynlEylxEesbYasc06i.jpg,2008-07-19,Ponyo,FALSE,7.7,4032,"Animation,Fantasy,Family",https://www.themoviedb.org/movie/12429
FALSE,/niRgVCgvDVxD67u6gjKZnkBO1AD.jpg,en,Batman: Gotham Knight,A chronicle of Bruce Wayne's establishment and progression into Gotham City’s legendary caped crusader through 6 standalone episodes.,37.325,/3i1o0sHBP0VUpuSVmkdCRKYoDBC.jpg,2008-07-08,Batman: Gotham Knight,FALSE,6.677,634,"Science Fiction,Animation,Action,Crime,Thriller",https://www.themoviedb.org/movie/13851
FALSE,/aDMoJ8NlpyzWblxUnscHKCafvjP.jpg,en,Presto,"Dignity. Poise. Mystery. We expect nothing less from the great turn-of-the-century magician, Presto. But when Presto neglects to feed his rabbit one too many times, the magician finds he isn't the only one with a few tricks up his sleeve!",14.785,/asmKQG2qhpVM1KD6x5kODAZPmZl.jpg,2008-06-27,Presto,FALSE,7.789,946,"Animation,Family,Comedy",https://www.themoviedb.org/movie/13042
FALSE,/vpviitHyakuHAGlVJOR3fvzN0YP.jpg,en,Futurama: The Beast with a Billion Backs,"Fresh off ripping space-time a new one at the end of ""Bender's Big Score,"" the Planet Express crew is back to mend the tear in reality, or (hopefully) at least not make it worse.  Beyond the tear, though, lurks a being of inconceivable...tentacularity.  What will become of Earth, and indeed, our universe, when faced with the Beast with a Billion Backs?",17.699,/2BW6JAW4wo7t5wD3WVfoijzosvt.jpg,2008-06-30,Futurama: The Beast with a Billion Backs,FALSE,6.98,521,"Animation,Comedy,Science Fiction,TV Movie",https://www.themoviedb.org/movie/12889
FALSE,/ai2FicMUxLCurVkjtYdSvVDWRmS.jpg,en,WALL·E,"What if mankind had to leave Earth and somebody forgot to turn the last robot off? After hundreds of years doing what he was built for, WALL•E discovers a new purpose in life when he meets a sleek search robot named EVE. EVE comes to realize that WALL•E has inadvertently stumbled upon the key to the planet's future, and races back to space to report to the humans. Meanwhile, WALL•E chases EVE across the galaxy and sets into motion one of the most imaginative adventures ever brought to the big screen.",101.343,/hbhFnRzzg6ZDmm8YAmxBnQpQIPh.jpg,2008-06-22,WALL·E,FALSE,8.1,18020,"Animation,Family,Science Fiction",https://www.themoviedb.org/movie/10681
FALSE,/d1RHScaZc7I8j0lDke1c4AxI435.jpg,en,Kung Fu Panda,"When the Valley of Peace is threatened, lazy Po the panda discovers his destiny as the ""chosen one"" and trains to become a kung fu hero, but transforming the unsleek slacker into a brave warrior won't be easy. It's up to Master Shifu and the Furious Five -- Tigress, Crane, Mantis, Viper and Monkey -- to give it a try.",383.366,/wWt4JYXTg5Wr3xBW2phBrMKgp3x.jpg,2008-06-04,Kung Fu Panda,FALSE,7.3,10965,"Action,Adventure,Animation,Family,Comedy",https://www.themoviedb.org/movie/9502
FALSE,/oTclC89GNdGQ25XjowvMlCpLyMi.jpg,he,Vals Im Bashir,An Israeli film director interviews fellow veterans of the 1982 invasion of Lebanon to reconstruct his own memories of his term of service in that conflict.,12.576,/zQaCv7lKwHsh0YSHkt1QNjIOZ1c.jpg,2008-06-12,Waltz with Bashir,FALSE,7.71,916,"Drama,Animation,War,Documentary",https://www.themoviedb.org/movie/8885
FALSE,/Nfwmdxl2EDvVVE4An18Lio6tSx.jpg,en,Horton Hears a Who!,"The classic and beloved story from Dr. Seuss is now a CG animated film from 20th Century Fox Animation, the makers of the Ice Age films. An imaginative elephant named Horton (Jim Carrey) hears a faint cry for help coming from a tiny speck of dust floating through the air. Horton suspects there may be life on that speck and despite a surrounding community, which thinks he has lost his mind, he is determined to save the tiny particle! Jim Carrey and Steve Carell lead an all-star cast in bringing this wonderful family picture to life!",52.564,/6k47Z3A5zI2rxubTMwiLyIqQLLr.jpg,2008-03-03,Horton Hears a Who!,FALSE,6.5,3121,"Animation,Comedy,Family,Adventure,Fantasy",https://www.themoviedb.org/movie/12222
FALSE,/ug8cy6tthmLWF4ZcFMCAvGkUXM7.jpg,ja,バイオハザード：ディジェネレーション,"Leon S. Kennedy and Claire Redfield must battle a rogue warrior seeking revenge after unleashing the deadly G-Virus, whilst a mutated monster goes on a rampage.",41.095,/3wSIagfHnR9vRAPyNjCfGzfgbXK.jpg,2008-02-13,Resident Evil: Degeneration,FALSE,6.77,995,"Animation,Horror,Action,Science Fiction",https://www.themoviedb.org/movie/13648
FALSE,/vO1VJevJIKIXGfveYHsLPn8iHUn.jpg,en,Shrek the Halls,"The Christmas tree isn't the only thing green in this new holiday classic. Shrek is back and trying to get into the spirit of the season. After promising Fiona and the kids a Christmas they'll remember, he is forced to take a crash course in the holiday. But just when he thinks he has everything for their quiet family Christmas just right, there is a knock at the door.",36.999,/xejoSLtxLNkglY5YkojlOkMHz3u.jpg,2007-11-28,Shrek the Halls,FALSE,6.356,807,"Adventure,Animation,Comedy,Fantasy,Family",https://www.themoviedb.org/movie/13394
FALSE,/7ArGqBWnPD3EWiwwteBzIbHOO7E.jpg,en,Futurama: Bender's Big Score,"The Planet Express crew return from cancellation, only to be robbed blind by hideous ""sprunging"" scam artists.  Things go from bad to worse when the scammers hack Bender, start traveling through time, and take Earth over entirely!  Will the crew be able to save the day, or will Bender's larcenous tendencies and their general incompetence doom them all?",17.661,/bmVE90IHvx4uXQgtbRtu4RyMWpt.jpg,2007-11-27,Futurama: Bender's Big Score,FALSE,7.421,642,"Animation,Comedy,Science Fiction,TV Movie",https://www.themoviedb.org/movie/7249
FALSE,/lIruQxRCxw5ZI3CmBL6VxwpKtUe.jpg,en,Beowulf,"A 6th-century Scandinavian warrior named Beowulf embarks on a mission to slay the man-like ogre, Grendel.",33.606,/7QsWYyJAV97N9jOh21pdRIqJeJq.jpg,2007-11-05,Beowulf,FALSE,5.891,2693,"Adventure,Action,Animation",https://www.themoviedb.org/movie/2310
FALSE,/lVfqLDmfrxIXFU2TcWTsG3ePdER.jpg,en,Bee Movie,"Barry B. Benson, a bee who has just graduated from college, is disillusioned at his lone career choice: making honey. On a special trip outside the hive, Barry's life is saved by Vanessa, a florist in New York City. As their relationship blossoms, he discovers humans actually eat honey, and subsequently decides to sue us.",49.566,/1xlHV0AMoXQAOPAZXLQgq39tRCJ.jpg,2007-10-28,Bee Movie,FALSE,6.023,4642,"Family,Animation,Adventure,Comedy",https://www.themoviedb.org/movie/5559
FALSE,/zAqsFZfVUsA1ZWUIsOwJisWktwO.jpg,en,Barbie as the Island Princess,"Shipwrecked as a child, Rosella (Barbie) grows up on the island under the watchful eyes of her loving animal friends. The arrival of Prince Antonio leads Rosella and her furry pals to explore civilization and ultimately save the kingdom by uncovering a secret plot.",41.823,/jSQPruo2kPI4L2JUIlOwRNfgwbM.jpg,2007-09-17,Barbie as the Island Princess,FALSE,7.23,685,"Animation,Family",https://www.themoviedb.org/movie/13283
FALSE,/c4L5nFbs72Cfe4Q4hF0T99USa1I.jpg,ja,ヱヴァンゲリヲン新劇場版：序,"After the Second Impact, Tokyo-3 is being attacked by giant monsters called Angels that seek to eradicate humankind. The child Shinji’s objective is to fight the Angels by piloting one of the mysterious Evangelion mecha units. A remake of the first six episodes of GAINAX’s famous 1996 anime series. The film was retitled “Evangelion: 1.01” for its DVD release and “Evangelion: 1.11” for a release with additional scenes.",42.215,/pETU4GurpeEjBOM8oytMH0yNBHx.jpg,2007-09-01,Evangelion: 1.0 You Are (Not) Alone,FALSE,7.597,874,"Animation,Science Fiction,Action,Drama",https://www.themoviedb.org/movie/15137
FALSE,/sZIJkZPKySo398Me4HLeUM7eCy0.jpg,ja,劇場版 NARUTO -ナルト- 疾風伝,"Demons that once almost destroyed the world, are revived by someone. To prevent the world from being destroyed, the demon has to be sealed and the only one who can do it is the shrine maiden Shion from the country of demons, who has two powers; one is sealing demons and the other is predicting the deaths of humans. This time Naruto's mission is to guard Shion, but she predicts Naruto's death. The only way to escape it, is to get away from Shion, which would leave her unguarded, then the demon, whose only goal is to kill Shion will do so, thus meaning the end of the world. Naruto decides to challenge this ""prediction of death.""",45.603,/vDkct38sSFSWJIATlfJw0l3QOIR.jpg,2007-08-04,Naruto Shippuden the Movie,FALSE,7.43,809,"Animation,Action,Fantasy",https://www.themoviedb.org/movie/20982
FALSE,/oTPSjQyETTFYDehdbiG8yi2oDmL.jpg,en,Superman: Doomsday,"When LexCorp accidentally unleashes a murderous creature, Superman meets his greatest challenge as a champion. Based on the ""The Death of Superman"" storyline that appeared in DC Comics' publications in the 1990s.",25.998,/itvuWm7DFWWzWgW0xgiaKzzWszP.jpg,2007-09-18,Superman: Doomsday,FALSE,6.711,586,"Action,Animation,Science Fiction,Family",https://www.themoviedb.org/movie/13640
FALSE,/8ln5VUVk7gnNGIb2VNgw8nICDVt.jpg,en,The Simpsons Movie,"After Homer accidentally pollutes the town's water supply, Springfield is encased in a gigantic dome by the EPA and the Simpsons are declared fugitives.",73.013,/gzb6P78zeFTnv9eoFYnaJ2YrZ5q.jpg,2007-07-25,The Simpsons Movie,FALSE,7.007,7657,"Animation,Comedy,Family",https://www.themoviedb.org/movie/35
FALSE,/xgDj56UWyeWQcxQ44f5A3RTWuSs.jpg,en,Ratatouille,"Remy, a resident of Paris, appreciates good food and has quite a sophisticated palate. He would love to become a chef so he can create and enjoy culinary masterpieces to his heart's delight. The only problem is, Remy is a rat. When he winds up in the sewer beneath one of Paris' finest restaurants, the rodent gourmet finds himself ideally placed to realize his dream.",121.635,/t3vaWRPSf6WjDSamIkKDs1iQWna.jpg,2007-06-28,Ratatouille,FALSE,7.817,16283,"Animation,Comedy,Family,Fantasy",https://www.themoviedb.org/movie/2062
FALSE,/qOfUKwYsRLaZJIdkTdQyNeeGc2f.jpg,en,Surf's Up,"A young surfer enters his first contest, hoping a win will earn him respect. But an encounter with a laid-back local forces him to rethink his values.",44.612,/tTDsCVlDA8QR4Dc6t6nERfwl5z.jpg,2007-06-08,Surf's Up,FALSE,6.404,2344,"Animation,Comedy,Family",https://www.themoviedb.org/movie/9408
FALSE,/6kqybERm5qi2jGpu8I7DaQPxpSU.jpg,fr,Persepolis,"In 1970s Iran, Marjane 'Marji' Statrapi watches events through her young eyes and her idealistic family of a long dream being fulfilled of the hated Shah's defeat in the Iranian Revolution of 1979. However as Marji grows up, she witnesses first hand how the new Iran, now ruled by Islamic fundamentalists, has become a repressive tyranny on its own.",16.115,/aU8i2QAdTyRR1nYb36Gq51xXP8p.jpg,2007-06-27,Persepolis,FALSE,7.907,1851,"Animation,Drama",https://www.themoviedb.org/movie/2011
FALSE,/qSNz1G1Ts8fFw6v4Vae4aMAjcY7.jpg,en,Shrek the Third,"The King of Far Far Away has died and Shrek and Fiona are to become King & Queen. However, Shrek wants to return to his cozy swamp and live in peace and quiet, so when he finds out there is another heir to the throne, they set off to bring him back to rule the kingdom.",92.25,/n4SexGGQzI26E269tfpa80MZaGV.jpg,2007-05-17,Shrek the Third,FALSE,6.294,8612,"Fantasy,Adventure,Animation,Comedy,Family",https://www.themoviedb.org/movie/810
FALSE,/92mpNNg6v2PN2HN2C2Z4g0v3Tya.jpg,en,TMNT,"After the defeat of their old arch nemesis, The Shredder, the Turtles have grown apart as a family. Struggling to keep them together, their rat sensei, Splinter, becomes worried when strange things begin to brew in New York City.",40.306,/6ZCWn7BGpDLBDigtdiuGyBdEqab.jpg,2007-03-23,TMNT,FALSE,6.119,1041,"Adventure,Animation,Comedy,Family",https://www.themoviedb.org/movie/1273
FALSE,/yOGELMEm6DPkdrBoJ7JbsyByCbn.jpg,en,Meet the Robinsons,"Lewis, a brilliant young inventor, is keen on creating a time machine to find his mother, who abandoned him in an orphanage. Things take a turn when he meets Wilbur Robinson and his family.",69.787,/naya0zF4kT401Sx15AtwB9vpcJr.jpg,2007-03-23,Meet the Robinsons,FALSE,6.901,2695,"Animation,Comedy,Family",https://www.themoviedb.org/movie/1267
FALSE,/7Ly4Smxxp5qBBxsoIZ4otEOG1kc.jpg,ja,秒速5センチメートル,"Three moments in Takaki's life: his relationship with Akari and their forced separation; his friendship with Kanae, who is secretly in love with him; the demands and disappointments of adulthood, an unhappy life in a cold city.",28.592,/dFipUR6W0y3PPkuVS8gjFd929m2.jpg,2007-03-03,5 Centimeters per Second,FALSE,7.306,1844,"Animation,Drama,Family,Romance",https://www.themoviedb.org/movie/38142
FALSE,/8IresDDceExrC67l7MxDOcITJTm.jpg,en,Cinderella III: A Twist in Time,"When Lady Tremaine steals the Fairy Godmother's wand and changes history, it's up to Cinderella to restore the timeline and reclaim her prince.",53.506,/98PHWv6TTpjxvs6EHKJVyrjuuus.jpg,2007-02-06,Cinderella III: A Twist in Time,FALSE,6.531,1190,"Animation,Romance,Family,Fantasy",https://www.themoviedb.org/movie/16119
FALSE,/9DUAR7p4SGqt2ISH2lmSzNx3uni.jpg,en,Happy Feet,"Into the world of the Emperor Penguins, who find their soul mates through song, a penguin is born who cannot sing. But he can tap dance something fierce!",63.212,/zP4CK9O70P8GDilfTkPm4lrmaks.jpg,2006-11-16,Happy Feet,FALSE,6.18,4885,"Animation,Comedy,Family",https://www.themoviedb.org/movie/9836
FALSE,/tMkLwH4mM6v751wG67iSSRtYxm7.jpg,en,The Fox and the Hound 2,"Best friends Tod, a fox kit, and Copper, a hound puppy, visit a country fair when they see a band of dogs called ""The Singin' Strays"". The band has five members: Dixie, Cash, Granny Rose, and twin brothers Waylon and Floyd. It is important that they perform well because a talent scout is visiting.",31.211,/uTrVvEtN4Gq7l0Zxd8KRYyiTvm3.jpg,2006-11-09,The Fox and the Hound 2,FALSE,6.004,627,"Adventure,Animation,Comedy,Family",https://www.themoviedb.org/movie/9948
FALSE,/7xQk3HdCvkNmk3gblDGn9fVnbsT.jpg,en,Flushed Away,"London high-society mouse, Roddy is flushed down the toilet by Sid, a common sewer rat. Hang on for a madcap adventure deep in the sewer bowels of Ratropolis, where Roddy meets the resourceful Rita, the rodent-hating Toad and his faithful thugs, Spike and Whitey.",54.855,/78czzq4yOr3yN2znedu0kWyv2Um.jpg,2006-10-22,Flushed Away,FALSE,6.276,3613,"Adventure,Animation,Comedy,Family",https://www.themoviedb.org/movie/11619
FALSE,/nnMXaofDjdWszZ7rbN9hKwK2PNg.jpg,en,Open Season,"Boog, a domesticated 900lb. Grizzly bear finds himself stranded in the woods 3 days before Open Season. Forced to rely on Elliot, a fast-talking mule deer, the two form an unlikely friendship and must quickly rally other forest animals if they are to form a rag-tag army against the hunters.",33.411,/w5Lctmkc1yah215Luxmci4djaiW.jpg,2006-09-27,Open Season,FALSE,6.15,2622,"Animation,Family,Adventure,Comedy",https://www.themoviedb.org/movie/7484
FALSE,/v5xXTpfMT5NpjQeDMNYNLflaiuA.jpg,en,Barbie in the 12 Dancing Princesses,"King Randolph sends for his cousin, Duchess Rowena, to help turn his daughters, Princess Genevieve and her eleven sisters, into royal material. But the Duchess strips the sisters of their fun, including their favorite pastime: dancing. When all hope may be lost, the sisters discover a secret passageway to a magical land where they can dance the night away.",46.412,/yBB7PwXRFJ29U8m8SnTcWVizFvM.jpg,2006-09-19,Barbie in The 12 Dancing Princesses,FALSE,7.57,1119,"Animation,Family",https://www.themoviedb.org/movie/13002
FALSE,/3IkChGhTllTULVWht55UDFHTg6Q.jpg,ja,パプリカ,"When a machine that allows therapists to enter their patient's dreams is stolen, all hell breaks loose. Only a young female therapist can stop it and recover it before damage is done: Paprika.",63.123,/bLUUr474Go1DfeN1HLjE3rnZXBq.jpg,2006-10-21,Paprika,FALSE,7.8,2235,"Drama,Mystery,Animation,Science Fiction,Thriller",https://www.themoviedb.org/movie/4977
FALSE,/dMqbyB5GQvDujXiKdKPhWT0VTRw.jpg,en,Brother Bear 2,"Kenai finds his childhood human friend Nita and the two embark on a journey to burn the amulet he gave to her before he was a bear, much to Koda's dismay.",40.156,/yaA8q2zHHUgFWdJNxXyAdU71SzM.jpg,2006-08-17,Brother Bear 2,FALSE,6.647,1405,"Adventure,Animation,Family",https://www.themoviedb.org/movie/10010
FALSE,/gwX3SeLU9vX3NYJPDW79Vn8bEJN.jpg,en,Barnyard,"When the farmer's away, all the animals play, and sing, and dance. Eventually, though, someone has to step in and run things, a responsibility that ends up going to Otis, a carefree cow.",25.199,/vPu2TfokecRICi9ScwtHh41RM4i.jpg,2006-08-04,Barnyard,FALSE,5.861,1029,"Animation,Comedy,Family",https://www.themoviedb.org/movie/9907
FALSE,/x5ufEAM7bS7DVXaovApamQh5BNE.jpg,ja,ゲド戦記,"Something bizarre has come over the land. The kingdom is deteriorating. People are beginning to act strange... What's even more strange is that people are beginning to see dragons, which shouldn't enter the world of humans. Due to all these bizarre events, Ged, a wandering wizard, is investigating the cause. During his journey, he meets Prince Arren, a young distraught teenage boy. While Arren may look like a shy young teen, he has a severe dark side, which grants him strength, hatred, ruthlessness and has no mercy, especially when it comes to protecting Teru. For the witch Kumo this is a perfect opportunity. She can use the boy's ""fears"" against the very one who would help him, Ged.",28.414,/y0VnJt4eRPMjA1hpJ8f1EFoVaSf.jpg,2006-07-29,Tales from Earthsea,FALSE,6.529,1248,"Animation,Fantasy,Adventure",https://www.themoviedb.org/movie/37933
FALSE,/zT7GDvQl2zgs0p3Z2wGwxsaEjNZ.jpg,en,The Ant Bully,"Fed up with being targeted by the neighborhood bully, 10-year-old Lucas Nickle vents his frustrations on the anthill in his front yard ... until the insects shrink him to the size of a bug with a magic elixir. Convicted of ""crimes against the colony,"" Lucas can only regain his freedom by living with the ants and learning their ways.",25.977,/oFuqX0inTvbA1XAFv2x3CQnI65m.jpg,2006-07-28,The Ant Bully,FALSE,5.711,1310,"Fantasy,Adventure,Animation,Comedy,Family",https://www.themoviedb.org/movie/9906
FALSE,/iu1Xxh86uRX7b5r0NpBv7qYRqBW.jpg,ja,時をかける少女,"When 17-year-old Makoto Konno gains the ability to, quite literally, ""leap"" backwards through time, she immediately sets about improving her grades and preventing personal mishaps. However, she soon realises that changing the past isn't as simple as it seems, and eventually, will have to rely on her new powers to shape the future of herself and her friends.",31.366,/xHnlWM8BmqY419YUccYy2KC5Jqo.jpg,2006-07-15,The Girl Who Leapt Through Time,FALSE,7.8,1929,"Fantasy,Animation,Drama,Science Fiction",https://www.themoviedb.org/movie/14069
FALSE,/lrUeu7XMNaKJn6v8ps0DHqUE11L.jpg,en,Garfield: A Tail of Two Kitties,"Jon and Garfield visit the United Kingdom, where a case of mistaken cat identity finds Garfield ruling over a castle. His reign is soon jeopardized by the nefarious Lord Dargis, who has designs on the estate.",35.597,/osfMaHucgLtHtsMa6TQLTooE3G7.jpg,2006-06-15,Garfield: A Tail of Two Kitties,FALSE,5.566,2065,"Animation,Comedy,Family,Adventure,Drama,Fantasy",https://www.themoviedb.org/movie/9513
FALSE,/aDnCTWpWMHcQxOeGWsITmoLuEGy.jpg,en,Monster House,"Monsters under the bed are scary enough, but what happens when an entire house is out to get you? Three teens aim to find out when they go up against a decrepit neighboring home and unlock its frightening secrets.",62.415,/zCRPr4bkO3ae0U1134vJ39xZnAG.jpg,2006-06-30,Monster House,FALSE,6.676,3765,"Animation,Comedy,Family,Fantasy",https://www.themoviedb.org/movie/9297
FALSE,/fdrQusLbssk6WEpyZXVDmyRlylE.jpg,en,A Scanner Darkly,An undercover cop in a not-too-distant future becomes involved with a dangerous new drug and begins to lose his own identity as a result.,19.322,/lUKudOpHICDj6A6SO7DdaZM4W48.jpg,2006-07-07,A Scanner Darkly,FALSE,6.802,1656,"Animation,Science Fiction,Thriller",https://www.themoviedb.org/movie/3509
FALSE,/foqRiTC2t4PgGrFdDkzgOIf9lOf.jpg,fr,Azur et Asmar,"Raised on tales of a Djinn fairy princess, Azur, a young Frenchman goes to North Africa in search of the sprite, only to discover that his close childhood friend, Asmar, an Arab youth whose mother raised both boys also seeks the genie.",13.583,/ezkzULav0JxvLS5JOnQcjbUmfWO.jpg,2006-05-21,Azur & Asmar: The Princes' Quest,FALSE,7.726,587,"Animation,Family",https://www.themoviedb.org/movie/19026
FALSE,/ohDtIpcfP2NXtvAANsQFsh76BO0.jpg,en,Over the Hedge,"A scheming raccoon fools a mismatched family of forest creatures into helping him repay a debt of food, by invading the new suburban sprawl that popped up while they were hibernating – and learns a lesson about family himself.",50.188,/tCRRGu9X1QWPc91KjAO5VYDcN2J.jpg,2006-05-17,Over the Hedge,FALSE,6.558,4261,"Family,Comedy,Animation",https://www.themoviedb.org/movie/7518
FALSE,/i8zpnOQEZI14iYXWHtbf6ct1Fo0.jpg,en,The Wild,"An adolescent lion is accidentally shipped from the New York Zoo to Africa. Now running free, his zoo pals must put aside their differences to help bring him back.",29.31,/sxqzaOto1qyUseSg6YpIP9Su5lp.jpg,2006-04-06,The Wild,FALSE,5.548,1001,"Family,Animation",https://www.themoviedb.org/movie/9904
FALSE,/yBdtVoQe010z8PRJBPaun0iCKso.jpg,fr,Astérix et les Vikings,"Asterix and Obelix have been given a tough mission: Transform the chief's lazy nephew Justforkix into a warrior. When the Vikings abduct him and bring him back to their homeland, Asterix and Obelix must travel to Norway to rescue Justforkix.",20.464,/dW9h1Ez6PRx8PnZUVT27MnG8Wu5.jpg,2006-04-05,Asterix and the Vikings,FALSE,6.147,662,"Family,Animation,Comedy,Adventure",https://www.themoviedb.org/movie/9642
FALSE,/wRTZaxAiDP0ZEeQsO0HiiSqYCSp.jpg,en,Ice Age: The Meltdown,"Diego, Manny and Sid return in this sequel to the hit animated movie Ice Age. This time around, the deep freeze is over, and the ice-covered earth is starting to melt, which will destroy the trio's cherished valley. The impending disaster prompts them to reunite and warn all the other beasts about the desperate situation.",75.161,/zDduhCHasKQ9YOTvlOreHem7Wbi.jpg,2006-03-29,Ice Age: The Meltdown,FALSE,6.697,9339,"Animation,Family,Comedy,Adventure",https://www.themoviedb.org/movie/950
FALSE,/hbvCZ12HiC6Dx4mbgeUr7aHBIPP.jpg,en,Barbie Fairytopia: Mermaidia,"In this animated follow-up to Fairytopia, Elina enlists the help of a mermaid, Nori, to save her friend Nalu, a merman prince who has been captured by the wicked Laverna.",40.535,/igsqS7rpnkAT92Iqo5sYwTs1KWo.jpg,2006-03-14,Barbie: Fairytopia - Mermaidia,FALSE,6.849,665,"Animation,Family,Adventure,Fantasy",https://www.themoviedb.org/movie/13285
FALSE,/sd4xN5xi8tKRPrJOWwNiZEile7f.jpg,en,Cars,"Lightning McQueen, a hotshot rookie race car driven to succeed, discovers that life is about the journey, not the finish line, when he finds himself unexpectedly detoured in the sleepy Route 66 town of Radiator Springs. On route across the country to the big Piston Cup Championship in California to compete against two seasoned pros, McQueen gets to know the town's offbeat characters.",63.263,/u4G8EkiIBZYx0wEg2xDlXZigTOZ.jpg,2006-06-08,Cars,FALSE,6.957,13336,"Animation,Adventure,Comedy,Family",https://www.themoviedb.org/movie/920
FALSE,/ebug4NE8EV0f345KwbNNS3T3dRh.jpg,en,Bambi II,"Return to the forest and join Bambi as he reunites with his father, The Great Prince, who must now raise the young fawn on his own. But in the adventure of a lifetime, the proud parent discovers there is much he can learn from his spirited young son.",24.198,/sIhTXgZjBSvW0B0BtTz0hvCrrH.jpg,2006-01-26,Bambi II,FALSE,6.494,935,"Animation,Drama,Family",https://www.themoviedb.org/movie/13205
