ID,devname_th,devnick_th,position,title,path,hashtag,desc_th,expertise_th,role_th,concept_th,concept_by_project_th,tech_th,process_th,hinder_th,lesson_th,feeling_th,devname_en,devnick_en,desc_en,expertise_en,concept_en,concept_by_project_en,tech_en,process_en,hinder_en,lesson_en,feeling_en
1,ปฏิภาณ ศรีชัย,ฟลุ๊ค,Data Analyst,,,,,"จัดการ data ผ่านโค้ด, process data ในสเกลที่ใหญ่ขึ้นกว่า google sheet, สามารถ automate data ในสเกลใหญ่ หรือจัดการ data ที่ไม่มีโครงสร้างให้มีโครงสร้างได้ เช่น scrape จากแหล่งที่ไม่มีระบบระเบียบ",คือการหาและ process data ตามที่ dev ในโปรเจกต์นั้นๆ ต้องการ ซึ่งธีมของโปรเจกต์นี้คือหนังและแอนิเมชัน,"(เนื่องจากฟลุ๊คทำหน้าที่ Data Analysis เลยให้ลองยกตัวอย่างสิ่งที่ต้องทำในแต่ละงาน)
ในงาน A DECADE of GENRE DIVERSITY ของปุ้ย โจทย์คือโฟกัสที่แอนิเมชันแต่ละ genre ว่าในแต่ละปีมีมากน้อยแค่ไหน เลยต้องไปทำงานกับเว็บที่รวบรวมข้อมูลแอนิเมชันเฉพาะทาง แล้ว scrape ให้ dev เอามาใช้ต่อ
ส่วนงาน How anime popular in the world ของพี่ป๊อบแป๊บ เป็นงานที่นำคะแนนอนิเมะจากญี่ปุ่นมาเทียบกับแอนิเมชันจากประเทศอื่นๆ เนื่องจากเป็นงานแอนิเมชันเหมือนกับงานก่อนหน้านี้ เลยไม่ต้อง scrape ใหม่ แต่เอามาคลีนและจัดระเบียบเพื่อให้ตอบโจทย์ของงานชิ้นนี้
งาน **Anime Industry** ของพี่บาส เป็นงานสามมิติที่โชว์ ประเภท ปี และแท็กของแอนิเมะญี่ปุ่น งานนี้ต้องดึงข้อมูลจากเว็บไซต์อีกเว็บที่รวบรวมอนิเมะญี่ปุ่นไว้โดยเฉพาะ
ส่วนงาน **Disney in Colors** ของพี่คีย์ ต่างไปจากอื่นๆ ตรงนี้โจทย์ของงานนี้เป็นเรื่องสี เปลี่ยนจากวิเคราะห์ text เป็นวิเคราะห์ภาพแทน มีความซับซ้อนตรงที่ต้องใช้ข้อมูลหลายแหล่ง คือต้องนำแหล่งข้อมูลรูปมา join กับฐานข้อมูลตัวละครและปีที่ฉาย
สุดท้าย งาน **Directors' Dialogue** ของพี่ลูกคิด เอาซับไตเติลจากหนังของผู้กำกับ เพื่อดูปริมาณการใช้คำในแต่ละส่วน เพื่อดูว่ามีการใช้คำในแต่ละเรื่องแตกต่างกัน — ใช้เว็บ file subtitle เอา text มาแปลงเป็น csv ","งาน **A Decade of Genre Diversity** ของปุ้ย โจทย์คือโฟกัสที่แอนิเมชันแต่ละ genre ว่าในแต่ละปีมีมากน้อยแค่ไหน เลยต้องไปทำงานกับเว็บที่รวบรวมข้อมูลแอนิเมชันเฉพาะทาง แล้ว scrape ให้ dev เอามาใช้ต่อ/

งาน **How Anime Popular in The World** ของพี่ป๊อบแป๊บ เป็นงานที่นำคะแนนอนิเมะจากญี่ปุ่นมาเทียบกับแอนิเมชันจากประเทศอื่นๆ เนื่องจากเป็นงานแอนิเมชันเหมือนกับงานก่อนหน้านี้ เลยไม่ต้อง scrape ใหม่ แต่เอามาคลีนและจัดระเบียบเพื่อให้ตอบโจทย์ของงานชิ้นนี้/

งาน **Anime Industry** ของพี่บาส เป็นงานสามมิติที่โชว์ ประเภท ปี และแท็กของแอนิเมะญี่ปุ่น งานนี้ต้องดึงข้อมูลจากเว็บไซต์อีกเว็บที่รวบรวมอนิเมะญี่ปุ่นไว้โดยเฉพาะ/

งาน **Disney in Colors** ของพี่คีย์ ต่างไปจากอื่นๆ ตรงนี้โจทย์ของงานนี้เป็นเรื่องสี เปลี่ยนจากวิเคราะห์ text เป็นวิเคราะห์ภาพแทน มีความซับซ้อนตรงที่ต้องใช้ข้อมูลหลายแหล่ง คือต้องนำแหล่งข้อมูลรูปมา join กับฐานข้อมูลตัวละครและปีที่ฉาย/

สุดท้าย งาน **Directors' Dialogue** ของพี่ลูกคิด เอาซับไตเติลจากหนังของผู้กำกับ เพื่อดูปริมาณการใช้คำในแต่ละส่วน เพื่อดูว่ามีการใช้คำในแต่ละเรื่องแตกต่างกัน — ใช้เว็บ file subtitle เอา text มาแปลงเป็น csv ",python ใช้ทั้ง scrape และ process ข้อมูล,"เริ่มจากความต้องการของผู้ใช้ data ว่าเขาต้องการ data แบบไหน จากที่ไหน บางแหล่ง ถ้าไม่จำเป็นต้อง scrape เช่น โหลดได้ หรือดึง API ได้ ก็ไม่ต้องทำ แต่ถ้าต้อง scrape ก็ต้องไปเขียนโค้ดเพื่อดึงออกมา
สิ่งที่อยากรู้จากผู้ใช้ data ก็คืออยากได้แบบไหนและเอาไปใช้ยังไง สำหรับ PM คำถามว่าจะเอา data แบบไหน คือ ให้บอก context ของการนำไปใช้ ว่าเอาไปวิเคราะห์ในมุมไหน บางที PM อาจไม่รู้ว่าจะหาคำตอบด้วยวิธีแบบไหน แต่การทำงานกับ dev สามารถตัด expectation และขั้นตอนบางอย่างได้ เช่น format ของไฟล์ ไม่จำเป็นต้องกังวลมากนัก อาจโยนเป็น json หรือไฟล์ดิบๆ ได้ แต่กับ PM อาจมีอุปสรรคด้านการสื่อสารอยู่บ้าง",เว็บที่ทำงานด้วย บางโปรเจกต์ต้องทำงานกับหลายเว็บไซต์พร้อมกัน บางเว็บไม่ได้ออกแบบให้เราขอข้อมูลได้ง่าย หรือออกแบบมาให้ scrape ยาก เราก็ต้องไปแก้ปัญหาตรงนั้น อุปสรรคอย่างที่สองก็คือความสกปรกของ data เพราะมันสร้างด้วยมนุษย์ บางครั้งมีความไม่สม่ำเสมอ ต้องคอยระวังและดักตรงนั้น,"“เกินดีกว่าขาด” เป็นแนวคิดในการ scrape — แล้วค่อยเอาข้อมูลที่ล้นๆ มาจัดการอีกที
โปรเจกต์เกือบทุกอันใช้การ scrape ข้อคิดคือการออกแบบโค้ดให้ reliable ในงานครั้งนี้หลายครั้งเราทำโค้ดที่มัน one-off คือไม่ได้ออกแบบมาเพื่อให้มันใช้ซ้ำได้ บางครั้ง approach ของเราไม่ได้เป็นแบบที่ reusable พอมีปัญหาขึ้นมา ก็พบว่าต้องมาทำใหม่อีกรอบ บทเรียนคือ ต่อให้มันจะใช้แค่ครั้งเดียว แต่ก็ออกแบบให้ reusable ไว้ก่อนดีที่สุด เพิ่ม effort แค่ประมาณ 20%
สิ่งที่อยากบอก dev ก็คืออยากให้ขอ format data มาอย่างชัดเจน กล้าขอมาตรงๆ เลย จะช่วยได้มาก คุยกันได้ ถ้ามันยากไป อย่างน้อยเราก็บอกได้ ส่วนสิ่งที่อยากบอก PM ก็คือ ขอ context ของงาน ก่อนที่จะทำงานจริงๆ ให้ได้เข้าใจ context มาก่อนจะดีกว่า ไม่งั้นจะไม่รู้ว่าสิ่งที่ดึงมาคืออะไร PM ควรจะเล่าเรื่องให้ฟังอย่างละเอียดก่อนถึงองค์ประกอบต่างๆ เช่น พรก. พรบ. ต่างกันอย่างไร ถ้ามีเวลาอยากให้มานั่งคุยกันเรื่อง domain knowledge",สนุกดีครับ ผมเนิร์ดหนังอยู่แล้ว พอได้ทำ data กับหนังก็ได้ฝึกสกิลปกติไปจับ data ใหม่ๆ ที่สนใจ ชอบอยู่แล้ว ก็ไม่ได้รู้สึกว่าเป็นงานที่ปวดหัว,Patiphan Srichai,Fluke,,"I manage data with code, processing it on a larger scale than you could in Google Sheets. I can automate data stuff on a big scale or take unstructured data and make it organized, like scraping data from messy sources.","(Since Fluke is a Data Analyst, I asked him to give examples of what he does in each project.) In Pui's project, ""A DECADE of GENRE DIVERSITY,"" the focus was on how the popularity of different animation genres changed each year. So, he had to work with a special animation website and scrape the data for the dev to use.  For Poppap's project, ""How anime popular in the world,"" he compared the ratings of Japanese anime with animation from other countries. Since it was also about animation, he didn't have to scrape new data, but he cleaned up and organized the data from the previous project.  For Bas's project, ""Anime Industry,"" which was a 3D thing showing the genre, year, and tags of Japanese anime, he had to pull data from another website specifically about Japanese anime.  Key's project, ""Disney in Colors,"" was different. It was all about the colors, so instead of analyzing text, he analyzed images. This was tricky because he had to use multiple sources, like finding images and then joining that data with character info and release year. Finally, Lookkid's project, ""Directors' Dialogue,"" used movie subtitles to see how often different words were used and if there were differences between movies. He got the text from a subtitle website and converted it to a CSV file.","In Pui's project, ""**A Decade of Genre Diversity**,"" the focus was on how the popularity of different animation genres changed each year. So, he had to work with a special animation website and scrape the data for the dev to use. /

For Poppap's project, ""**How Anime Popular in The World**,"" he compared the ratings of Japanese anime with animation from other countries. Since it was also about animation, he didn't have to scrape new data, but he cleaned up and organized the data from the previous project. / 


For Bas's project, ""**Anime Industry**,"" which was a 3D thing showing the genre, year, and tags of Japanese anime, he had to pull data from another website specifically about Japanese anime. /

Key's project, ""**Disney in Colors**,"" was different. It was all about the colors, so instead of analyzing text, he analyzed images. This was tricky because he had to use multiple sources, like finding images and then joining that data with character info and release year. /

Finally, Lookkid's project, ""**Directors' Dialogue**,"" used movie subtitles to see how often different words were used and if there were differences between movies. He got the text from a subtitle website and converted it to a CSV file.",I used Python for both scraping and processing the data.,"It began with figuring out what the data users needed and where to get that data. Some sources didn't require scraping, like if I could download the data or use an API. But if we had to scrape, then I wrote the code to extract it. I also needed to know from the data users what format they wanted the data in and how they were going to use it. For the PM, asking ""what kind of data do you need?"" means understanding the context of how it will be used and what kind of analysis they're doing. But working with a developer can help cut down on expectations and steps. For example, I don't need to worry too much about the file format; it can be a JSON or even a raw file. But there can be some communication barriers with PMs.","Some projects required working with multiple websites at the same time, and some weren't designed to make it easy to get data or were difficult to scrape. So, I had to find workarounds for that. The second obstacle was dealing with messy data. Because it's human-generated, sometimes there are inconsistencies, and I had to be careful and account for those.","""Better to have too much than not enough"" was my approach to scraping — and then deal with the extra data later. Almost all of my projects involve scraping. One lesson I learned is to design code for reliability. In this project, I often wrote one-off code that wasn't designed to be reused. Sometimes my approach wasn't reusable, so when problems came up, I had to start over. The lesson is, even if you're only going to use it once, design it to be reusable from the start. It only takes about 20% more effort. For developers, I'd say ask for a clear data format upfront. Be direct about it. It will help a lot. You can always discuss it. If it's too difficult, at least you've communicated that. For PMs, I'd say ask for the context of the project before starting the actual work. It's better to understand the context first; otherwise, you won't know what you're extracting. PMs should explain the story in detail before getting into the specific components, like how different regulations and laws are different. If there's time, it would be great to sit down and discuss the domain knowledge.","It was fun! I'm a movie nerd, so working with movie data allowed me to practice my usual skills and explore new data that I'm interested in. I didn't find it stressful at all."
2,ชลธิชา หลี่,ปุ้ย,Front-end Intern,A Decade of Genre Diversity,a-decade-of-genre,#animation #genre #year,ย้อนรอย 24 ปี เส้นทางแอนิเมชัน เปรียบเทียบสัดส่วนการผลิตแอนิเมชันในแต่ละหมวดหมู่,ชอบ front-end ถนัดมากกว่าส่วน back-end — เอนจอยกับทั้งทำให้ตรงกับ UI และการเขียนฟังก์ชัน,เป็นเด็กฝึกงาน เป็นงานที่สอง ต่อจากโปรเจกต์ที่ทำคู่กับพี่ป๊อปแป๊บ งานนี้ได้ขึ้นทั้งดีไซน์และขึ้นเว็บเอง ,อยากนำเสนอสิ่งที่น่าสนใจและเราชอบด้วย เราสนใจเรื่องหมวดหมู่อนิเมชัน อยากรู้ว่าในอุตสาหกรรมนี้เลือกที่จะนำเสนอหมวดหมู่ไหนในคนดูมากที่สุด ตั้งแต่ปี 2000-2023 สิ่งที่ค้นพบก็คือหมวด family เยอะมาก ทั้งที่ตอนแรกคิดว่าเป็นแฟนตาซีหรือ action,,ใช้ astro เป็นฐานเพื่อให้ dev ใช้เฟรมเวิร์กที่ต่างกันได้หลายแบบ ส่วนงานตัวเองใช้ vue เพราะอยู่กับมันมานาน คอมฟอร์ตประมาณหนึ่ง แต่คนอื่นๆ อาจจะใช้ reactในโปรเจกต์นี้เหมือนกัน,เริ่มต้นคือ Tech Lead ซึ่งคือพี่ลูกคิดบอกว่าอยากทำอะไร จากนั้นก็คิด topic แล้วส่งให้ Data Analyst คือฟลุ๊คจัดการเตรียมข้อมูลให้ เมื่อได้ข้อมูลที่ต้องการแล้ว ก็ไปเลือก data viz ที่ต้องการ ศึกษาเรื่องชาร์ตต่างๆ ดู พอได้ดีไซน์ที่อยากจะทำก็ลงมือทำเลย,อย่างแรกคืออนิเมชันมีหมวดหมู่ที่ประหลาด ไม่ได้แบ่งตามที่เราคิด บางอันใส่แค่คำว่า animation แต่ไม่ได้มีหมวดหมู่บ่งบอก ก็ต้องตัดออกไป ส่วนในเรื่องเทคนิค มีเรื่อง zoom ที่ยังไม่สมูธ เราใช้ d3 แล้วอยากให้ซูมได้และขยับไปตามเมาส์ได้ โค้ดโฟกัสที่การซูมและการขยับ แต่มันกลับเด้งออกไป อาจต้องใช้เวลาศึกษาปัญหาให้ลึกกว่านี้ และเรื่องดีไซน์ ตอนแรกมึนเลยว่าต้องทำยังไงให้แปลกใหม่และเข้ากับข้อมูล งานนี้ได้คำแนะนำจากดีไซเนอร์เยอะ ว่าทำแบบไหนถึงจะน่าสนใจขึ้น ตอนแรกที่คิดในหัวมันยังไม่ว้าวพอ,พอทำงานอย่างงี้ต้องมีภาพในหัวชัด ต้องมีเป้าชัดๆ จริงๆ ว่าเราจะทำเรื่องไหน คนดูจะทำอะไรกับงานนี้ได้บ้าง ถ้าเป้าไม่ชัด เราต้องเติมไปเรื่อย ทำไปเรื่อย ก็อาจจะใช้เวลาเยอะ พอเป็นเรื่องหนังที่ต้องใช้หลายเว็บ ก็อาจจะยุ่งยาก ถ้ามี source ที่เหมาะๆ ก็น่าจะใช้แหล่งนั้นไปเลยมากกว่า,สนุกนะ เพราะปกติเป็น dev ก็ทำตามดีไซน์ คราวนี้ได้มาดีไซน์เองด้วย แต่มันอาจจะยากนิดนึง โดยรวมเอนจอยกับโปรเจกต์นี้ ยกเว้นเรื่องซูม อะไรที่แก้ไม่ได้แล้วมันรู้สึกแปลกๆ,Chonticha Li,Pui,Retracing the 24-Year Journey of Animations: Comparative Analysis of Genre Distribution in Animation Production,I'm more of a front-end person. I'm better at that than back-end stuff. — I really enjoy making things match the UI and writing functions.,"I wanted to present something cool that I'm also into. I'm really interested in animation, so I wanted to find out which genres were the most popular from 2000 to 2023.  Turns out it's family movies. I thought it would be fantasy or action, but nope, family stuff.",,We used Astro as the foundation so that everyone could use their preferred framework. I personally went with Vue because I've been using it forever and it's super comfortable for me. But some of the others used React for this project.,"It started with our Tech Lead, Lookkid, telling us what he wanted us to do. Then I thought about the topic and passed it on to Fluke, our Data Analyst, to gather the data. Once I had what I needed, I chose the data visualizations I wanted, researched different chart types, and then just dove in and started designing.","The first thing was that the animation categories were weird. They weren't divided the way I expected. Some were just labeled ""animation"" without any specific genre, so I had to leave those out. On the technical side, there's the zoom function, which isn't very smooth yet. I'm using D3, and I wanted to be able to zoom and pan with the mouse. The code focuses on zooming and panning, but it keeps bouncing around. I might need to spend more time figuring out that problem. And then there's the design. At first, I was totally lost on how to make it unique and fit the data. I got a lot of advice from the designers on how to make it more interesting. My initial ideas weren't impressive enough.","When you work on something like this, you need to have a clear picture in mind, a really specific goal, about what you're trying to do and how people will interact with it. If the goal isn't clear, you end up adding things and making changes as you go, which can take a lot of time. When it comes to movies and having to use multiple websites, it can get complicated. If there's a good source available, it's better to stick with that.","It was fun because usually as a dev, I just follow the design. This time I got to do the design myself, but it was a bit challenging. Overall, I enjoyed this project, except for the zoom issue. It feels weird when there's something you can't fix."
