ID,devname_th,devnick_th,position,title,path,hashtag,desc_th,expertise_th,role_th,concept_th,concept_by_project_th,tech_th,process_th,hinder_th,lesson_th,feeling_th,devname_en,devnick_en,desc_en,expertise_en,concept_en,concept_by_project_en,tech_en,process_en,hinder_en,lesson_en,feeling_en
3,วรวิทย์ เริงรื่น,บาส,Front-end Developer,Anime Industry,anime-industry,#manga #subgenre #year,ชาร์ตแบบ 3 มิติ แสดงให้เห็นการเปรียบเทียบอันซับซ้อนระหว่างฤดูกาล ปี และหมวดหมู่ย่อยของอะนิเมะที่ผลิตโดยสตูดิโอหลากหลายสตูดิโอของญี่ปุ่น,เรื่องการครีเอท front-end viz ที่ค่อนข้างคล่องแคล่ว ส่วนใหญ่ก็คือตามดีไซเนอร์สร้างสรรค์มาอย่างสุดฝีมือ แล้วเราก็ทำให้ตรงกับดีไซน์,,"ตอนนั้นสโคปหลักคืออนิเมะหรือหนัง หรืออะไรก็ตามที่เกี่ยวกับอุตสาหกรรมหนัง ส่วนตัวชอบอนิเมะญี่ปุ่น ดูมาเยอะ เลยรู้สึกว่ามีเทรนด์บางอย่างที่เกิดขึ้นในอนิเมะ เช่นแอคชันที่ถูกผลิตซ้ำมาเรื่อยๆ เช่น แนวโชเนน พักหลังมีแนวอีกแนวที่โผล่มาเยอะ คืออิเซไก และ reincarnation คือเราตายในโลกนี้แล้วไปเกิดอีกที่นึง ซึ่งเกิดในช่วง 4-5 ปีนี้ค่อนข้างเยอะ เลยอยากรู้ว่ามันเพิ่มขึ้นมาเท่าไหร่ 
เราดูอนิเมะอยู่แล้วก็มีสมมติฐานเบื้องต้น เห็นอยู่ว่าอะไรมากขึ้นและผลิตมากขึ้น สาเหตุที่นำเสนอเป็น 3 มิติ คือเป็นการทดลองล้วนๆ ถือเป็นเทคนิคใหม่ เพราะปกติเราทำแบบ 2D เลยอยากทดลองวิธีการว่ามันจะออกมาเป็นยังไง ออกมาได้เป็น area chart ที่เป็น stack ใน dimention นึง ส่วนที่ทำให้หมุนไปเรื่อยๆ เพื่อจะได้ให้ user รู้ว่ามันหมุนได้",,base เลยคือ D3 คือตัวจัดการข้อมูลและตัว viz  ใช้ในการ transform ข้อมูลบางส่วน จากนั้นก็ generate viz แบบ 2Dได้มาเป็น area chart แล้วนำตัว 2D ไป render เป็น 3D ในส่วน 3D เราใช้ lib Three.js,"เราคิดในเชิงข้อมูล อนิเมะจะมีข้อมูลราย season คือปีนึงมี 4 ซีซัน และข้อมูลก็ย้อนไปได้ถึง 1990 ซึ่งให้ฟลุ๊คเป็นคนรวบรวมให้ พอเวลา render เราก็กะว่าใน 3d space เราจะวางเป็นไทม์ไลน์ว่าในซีซันนี้มีเท่าไหร่ มี genre อะไรบ้าง แต่พอลองทำดูแล้วคิดว่าน่าจะใช้ category เป็นตัวแยกมากกว่า
เราทำให้สามารถฟิลเตอร์รายสตูดิโอได้ จะได้รู้ว่าสตูดิโอนั้นผลิตแนวไหนเท่าไหร่ อะไรขายดี ตอนนี้กำลังปรับแก้ และบางส่วนที่ไฮท์ไลต์ข้อมูล ถ้ายังไม่รู้ insights ก็ยังดูไม่ออก เลยอาจจะมีการเน้นสีหรือสรุปข้อมูลให้เป็นตัวเลขเพิ่มเติมขึ้นมา",เป็นเรื่องดีไซน์ ตอนที่ลูกคิดแนะนำให้เปลี่ยนแกน ก็มึนๆ เพราะเราจินตนาการตามสมมติฐานของเรามา พอลองเอาข้อมูลมาวางจริงๆ แล้วก็ต้องเปลี่ยน เพื่อให้มันสื่อสาร เราไม่ได้ถนัดมาก,เอ่อ 3D อาจจะแค่สนุกเฉยๆ ครับ (หัวเราะ) แต่อาจจะไม่ค่อยสื่อเท่าไหร่ อาจจะใช้ในประโยชน์อื่นได้ แต่ในฐานะ dev ก็พอทำได้ จัดมาเลย,สนุกดีครับ ได้ explore ดี แต่ถ้าจะทำอีก มันอาจจะไม่ได้จบที่เรา เราต้องรบกวนฟลุ๊ค แต่เราไม่ได้คลีนหรือทำอะไรมากไปกว่านั้น ซึ่งมันอาจจะมีอะไรที่น่าทำอยู่ ในตัวกระบวนการอื่นๆ อาจมีผู้เชี่ยวชาญที่ทำให้มันสุดกว่านี้ได้ หรือในเชิงดีไซน์เราก็ดีไซน์แบบบ้านๆ ถ้าดีไซเนอร์สล็อตว่างก็น่ามาช่วย redesign ได้ อาจจะไม่ต้องใช้ effort เยอะ,Worawit Roengruen,Bas,"A 3D visualization showing a complex comparison between seasons, years, sub-genres of anime produced by various Japanese studios.","I'm pretty good at creating front-end visualizations. Usually, I take the awesome designs that the designers come up with and make them a reality.","At the time, the main scope was anime, movies, or anything related to the film industry.  Personally, I'm a big fan of Japanese anime, and I've noticed some trends, like the constant stream of action shows, especially shonen anime. Lately, there's been a surge in another genre: isekai and reincarnation, where you die in this world and are reborn in another. This has become really popular in the last 4-5 years, so I wanted to see just how much it had grown.  Since I watch anime regularly, I already had some initial assumptions. I could see what was becoming more popular and what was being produced more. The reason I presented it in 3D was purely experimental. It was a new technique for me. I usually work in 2D, so I wanted to try something different and see how it would turn out. It ended up as an area chart with stacks in one dimension. I made it rotate so users would know they could interact with it.",,"The base was D3, which I used for data management and visualization. I used it to transform some of the data and then generate a 2D area chart. Then, I used the Three.js library to render the 2D chart in 3D.","I was thinking in terms of the data. Anime data is organized by season, with four seasons per year, and the data goes all the way back to 1990. Fluke gathered all of that for me. When it came to rendering, I planned to lay it out in 3D space as a timeline, showing how many anime were in each season and what genres they were. But after trying that, I thought it would be better to separate them by category. I made it possible to filter by studio, so you can see how many of each genre a studio produces and what sells well. I'm currently making some adjustments. Some parts highlight the data, but if you don't already know the insights, it might not be clear, so I might add some color emphasis or summarize the data with numbers.","The design was a challenge. When Lookkid suggested changing the axis, I was a bit confused because I had been visualizing it based on my own assumptions. But when I actually put the data in, I realized I needed to change it to make it communicate effectively. It's not my strongest area.","Uh, 3D might just be for fun (laughs). But it might not be very informative. It could be useful for other things, but as a developer, I can do it, so bring it on.","It was fun. I got to explore a lot. But if I were to do it again, it might not end with me. I would need to ask Fluke for help, but I wouldn't be cleaning or doing much beyond that, which might leave some things unexplored. In other parts of the process, there might be experts who could take it further. And in terms of design, I just did a basic design. If the designers had free time, it would be great if they could help redesign it. It might not take much effort."
4,วิถี ภูษิตาศัย,ลูกคิด,Technical Lead,Directors' Dialogue,directors-dialogue,#movie #wordcount #sentiment,วิเคราะห์สไตล์เฉพาะตัวของผู้กำกับแต่ละคนผ่านบทสนทนาในภาพยนตร์ของพวกเขา คัดเลือกจากผู้กำกับที่มีความหลากหลายทางเชื้อชาติและมีผลงานเป็นที่คุ้นเคย สร้างสรรค์ออกมาเป็นชาร์ตเปรียบเทียบบทสนทนาในภาพยนตร์แต่ละเรื่อง โดยยึดจากซับไตเติลภาษาอังกฤษ (หรือคำแปลภาษาอังกฤษ หากต้นฉบับเป็นภาษาอื่น),เราเป็นเป็ดฝั่ง dev คิด แต่งานที่เป็น viz และ front-end คือส่วนที่ชอบที่สุด มองเห็น จับต้องได้ แสดง data ออกมาให้เห็นได้,,"ธีมเป็นเรื่องหนัง เป็นโปรเจกต์ที่พยายามปล่อยจอยแล้ว data driven จริงๆ ไม่เหมือนโปรเจกต์อื่นที่มันอาจจะมีธงอยู่แล้วว่าข้อสรุปน่าจะเป็นอย่างนั้น เราอยากคุ้ย data เรื่อง subtitle และเป็นโปรเจกต์ที่ไม่มั่นใจที่สุดว่าเจอข้อสรุปอะไร ได้ลองใช้เวลากับมันจริงๆ เป็นครั้งแรก ซึ่งก็มีความเป็นวิทยาศาสตร์ คือการตั้งสมมติฐาน ลอง viz มาเร็วๆ แล้วลองพลิกๆ เพื่อดูว่าอะไรน่าสนใจ และจะกลายประเด็นหลักของงาน
งานนี้ได้ใช้ viz สองตัวที่เป็นโหมดซูมอิน ซูมเอาต์ด้วย",,challenge ตัวนึง คือจะใช้เทคโนโลยีที่เรียบง่ายที่สุด มีแค่ d3 ที่เอามาใช้ ส่วนที่เหลือคือเบสิก โจทย์ของเราคือ “มาลองทำ viz ตัวนึง โดยใช้อะไรที่เรียบง่าย” เพราะบางครั้งการมีเยอะโดยไม่จำเป็นก็อาจส่งผลต่อประสิทธิภาพของเว็บ และbuild it from scratch จริงๆ จะทำให้ได้เรียนรู้จากการทำเองได้มากกว่าการไปหยิบสิ่งที่คนทำไปแล้ว,"เริ่มต้นจาก dataset ก่อน ยังไม่รู้ว่าโจทย์คืออะไร แต่ให้ฟลุ๊คไปโหลดดาต้ามาตาม criteria ตามที่กำหนด โดยมีสมมติฐานว่ามีลายเซ็นของผู้กำกับแต่ละคนอยู่ในซับไตเติล โดยเลือกจากหนังที่เราเคยดู มาลิสต์ให้ฟลุ๊คลองกวาด data มาก่อน โดยใช้กระบวนการ eda หรือ exploratory data analysis คือลองกวาดข้อมูลมาลองพลิกดูว่ามันจะทำอะไรได้บ้าง ตั้งสมมติฐาน แล้วลองพล็อตดูแบบเร็วๆ ไม่เน้นความสวยงาม จนกว่าจะเห็นมุมที่น่าสนใจ 
จนเจอว่าแต่ละคนใช้คำต่อนาทีเป็นยังไง เช่น หนังไซไฟใช้คำเยอะมาก เพราะต้องอธิบายให้คนดู หรือบางคนพูดเยอะ แต่ก็มีจังหวะหยุดเยอะ ส่วนหนังอินเดีย แทบไม่มีนาทีไหนที่ไม่มีใครไม่พูดเลย เลยพบว่านี่แหละคือสิ่งที่เราจะดึงไปใช้ เกณฑ์ในการเลือกผู้กำกับคือ เคยดู ชื่นชอบ และหลากหลาย แม้จะมีอยู่ในหัวคร่าวๆ แต่พล็อตออกมาแล้วมีอะไรที่น่าสนใจกว่าที่คิดเอาไว้ เช่นหนังอินเดีย
จากนั้นก็ออกแบบ UI แบบคร่าวๆ เพื่อเอาไป dev ต่อ ใช้เวลากับส่วนวิเคราะห์ข้อมูลนี้ประมาณ 3 วัน และ dev เว็บ 3 วัน","ตอนแรกหยิบผู้กำกับที่ชอบมาเท่านั้น แต่ปรากฏว่ามันขาด representation บางอย่าง เช่น เชื้อชาติ หรือประเภทหนัง พอพล็อตมาตอนแรกแล้วพบว่าตัวเองเลือกมาแต่ผู้กำกับที่พูดเยอะ
อุปสรรคอีกข้อก็คือการทำความสะอาด subtitle เนื่องจากมันไม่ได้เป็นแค่ dialog แต่มันมีโฆษณาและเครดิตคนแปลด้วย เราก็ต้องหาทางตัดมันออกด้วย",การทำงานสไตล์ data driven มันดีตรงที่เราได้ insights จาก data จริงๆ แล้วค่อยเอามานำเสนอ ไม่เหมือนกับการทำงานแบบมีธง แล้วพบว่า fail คือมันไม่ได้น่าสนใจอย่างที่คิด แต่ก็ยังมาหาทางทำให้มันน่าสนใจกันทีหลัง นี่เป็นจุดเด่น แต่ข้อเสียคือเราต้องเพิ่มเวลาในการวิเคราะห์ คิดว่าน่าจะย้ายเวลาปรับปรุงในส่วนท้ายมาใส่ในส่วนต้นแทน แต่ต้องมีสกิลในการเล่นกับ data พอสมควร เชียร์ให้ทุกคนลองทำงานกับฟลุ๊ค ซึ่งอาจจะต้องมีการทำงานกันกลับไปกลับมา,"สนุก เป็นนิสัยส่วนตัวอยู่แล้วที่หาทำ แต่เห็นประโยชน์ว่าได้นำอะไรมาแชร์กับทีม ดีใจและภูมิใจที่คนในทีมทำงานออกมาได้ และเห็นกันและกันชัดขึ้นว่าใครถนัดอะไร ชอบอะไร หรือไม่ชอบอะไร บางคนได้เห็นว่าตัวเองชอบอะไรที่มากกว่าการ dev และจะได้ไปฝึกตรงนั้น

ตัวงานของแต่ละคนอาจไม่เว่อร์วัง เพราะเวลาที่จำกัดและความไม่ถนัด แต่ในมุม learning มันก็เป็นโปรเจกต์ที่คุ้มค่ากับเวลาที่เสียไป และน่าทำต่อในอนาคต",Withee Poositasai,Lookkid,"Could we see some director' styles by analyzing their dialogue? From the directors with diverse nationalities whom I am familiar with, here are the visualization of their movies' dialogue based on English subtitles (translated if not originally in English).","I'm kind of a jack-of-all-trades when it comes to dev work, but I really love viz and front-end stuff the most. It's something you can actually see and interact with, and it's a way to really show the data.","The theme was movies. This project was a real attempt to let go and be truly data-driven. Unlike other projects where you might already have an idea of what the conclusion will be, I wanted to dig into the subtitle data. It was the project where I was least sure about what I would find.  For the first time, I really took the time to explore the data. It was a scientific approach: making hypotheses, quickly creating visualizations, and then trying different things to see what was interesting and what could become the main focus of the project.  In this project, I used two visualizations with zoom in and zoom out modes.",,"I only used D3, and the rest was basic stuff. My challenge was, ""Let's try to make a visualization using only simple tools."" Sometimes, having too much unnecessary stuff can affect the website's performance. And building it from scratch really allows you to learn more than just using something someone else has already made.","I started with the dataset before I even knew what the question was. I had Fluke download the data based on the criteria I set, with the assumption that each director's signature would be present in the subtitles. I chose movies I had seen and made a list for Fluke to scrape data from. I used an EDA (exploratory data analysis) process, which means I gathered the data and explored it to see what we could do with it. I made hypotheses and quickly plotted the data without focusing on aesthetics until we found something interesting. I discovered patterns in how many words per minute each director used. For example, sci-fi movies use a lot of words because they have to explain things to the audience. Some directors talk a lot but also have a lot of pauses. And in Indian films, there's almost never a moment of silence. I realized this was what I wanted to focus on. The criteria for choosing directors were that I had seen their movies, liked them, and that they represented a diverse range. Even though I had a rough idea in mind, the chart revealed things that were more interesting than we expected, like the patterns in Indian films. Then, I created a rough UI design to use for development. I spent about three days on the data analysis and another three days developing the website.","At first, I only included directors I liked, but it turned out that it lacked representation in terms of ethnicity and movie genres. When I first plotted the data, I realized I had only chosen directors who talked a lot. Another obstacle was cleaning up the subtitles. They weren't just dialogue; they also included ads and translator credits, so I had to find a way to remove those.","The good thing about working in a data-driven way is that you get real insights from the data and then present them. It's different from working with a predetermined conclusion and then finding out it fails because it's not as interesting as you thought, and then trying to make it interesting after the fact. That's the advantage. But the downside is that you need to add more time for analysis. I think it would be better to shift the time spent on revisions from the end to the beginning. But you need to have decent data skills. I encourage everyone to try working with Fluke, even though it might involve going back and forth a bit.","It was fun. I'm always looking for things to do, but I also saw the benefit of being able to share something with the team. I'm happy and proud that the team was able to produce this work, and it helped us see each other more clearly in terms of what we're good at, what we like, and what we don't like. Some people realized that they enjoy things beyond development, and now they can focus on improving those skills. The individual projects might not be super impressive because of the time constraints and lack of experience, but from a learning perspective, it was a worthwhile project, and we should continue doing this in the future."
