ID,devname_th,devnick_th,position,title,path,hashtag,desc_th,expertise_th,role_th,concept_th,concept_by_project_th,tech_th,process_th,hinder_th,lesson_th,feeling_th,devname_en,devnick_en,desc_en,expertise_en,concept_en,concept_by_project_en,tech_en,process_en,hinder_en,lesson_en,feeling_en
5,ณอนงค์ สำเร็จวิทย์,คีย์,Front-end Developer,Disney in Colors,disney-in-colors,#color #character #year,โปรเจกต์นี้รวบรวมข้อมูลภาพของตัวละครดิสนีย์ระหว่างปี 1937-2024 เพื่อวิเคราะห์และเปรียบเทียบชุดสีที่ใช้ในการออกแบบตัวละครฮีโร่และตัวร้าย เพื่อสังเกตแนวโน้มการใช้สีและความหลากหลายของการใช้สีในแต่ละปี เผยให้เห็นว่าสีใดเชื่อมโยงกับความดีและความชั่วจากมุมมองของผู้สร้างสรรค์การ์ตูนดิสนีย์,หลักๆ ทำงานฝั่ง front-end ทำตามที่ดีไซเนอร์ออกแบบ สิ่งที่ถนัดคือใช้ CSS สร้างเลย์เอาต์ สร้าง element ต่างๆ หรือทำ styling แปลกๆให้ตรงตามดีไซน์,,"โปรเจกต์นี้ พอลูกคิดบอกว่าจะมีสิ่งนี้ คือได้ออกแบบและ dev ด้วยตัวเองก็รู้สึกดีใจมาก เป็นงานที่เฝ้ารอมาตลอด ปกติเราทำตามคนอื่นตลอดเวลา แต่คราวนี้ได้ทำตามสิ่งที่ตัวเองคิด บางทีที่ดีไซเนอร์คิดมา เราอาจเสนออะไรที่มีตามกรอบประมาณหนึ่ง แต่งานนี้กรอบมันกว้างมาก มันเริ่มจากกระดาษเปล่าๆ ที่เราอยากใส่อะไรลงไปก็ได้
งานนี้เป็นธีมหนังและแอนิเมชัน ตอนที่ฟังโจทย์ก็อยากทำอะไรเกี่ยวกับดิสนีย์ เพราะชอบดู และสิ่งที่สนใจคือตัวละครต่างๆ ในดิสนีย์ แต่ก็คิดว่าจะแมตช์กับเรื่องอะไร มิติอะไรดี สุดท้ายก็มาจบที่เรื่องสี อยากรู้แนวโน้มการใช้สีของตัวละครดิสนีย์แต่ละปี แบ่งเป็นฝั่งตัวดีและตัวร้าย อยากรู้ว่าในแต่ละปีมีหลักในการแบ่งสีแต่ละฝั่งยังไง มีแนวโน้มการใช้สียังไง เมื่อก่อนตัวร้ายอาจจะเป็นสีดำ สีม่วง ปัจจุบันตัวร้ายน่าจะมีการใช้สีที่หลากหลายขึ้น อยากนำสิ่งนี้มา viz เพื่อดูว่าหน้าตาข้อมูลมันจะเป็นอย่างที่เราคิดจริงหรือเปล่า",,"ใช้ Vue คือสิ่งที่ตัวเองถนัดอยู่แล้ว เพราะว่าอยากลงไปในเรื่องดีไซน์และการหาข้อมูลมากกว่า อยากสนุกกับพื้นที่ตรงนี้มากกว่าส่วน dev ในเชิง dev ไม่ได้มีอะไรใหม่มาก สุดท้ายก็มาจบที่ stack bar chart ธรรมดา แต่ก็อาจจะตอบโจทย์ที่สุดกับสิ่งที่เราอยากเล่า การเลือก viz ก็เลยทำให้เราไม่ต้องใช้ tech อะไรที่มันล้ำมาก
จริงๆ ก็มีหลายอย่างที่ใหม่ในงานนี้ เช่น การคิดโจทย์ คิดประเด็นว่าอยากสื่อสารอะไรให้คนอ่านเห็น และในเรื่องของดีไซน์ว่าจะคิด viz ยังไง ใส่ลูกเล่นหรือองค์ประกอบอะไรลงไปในงาน","เริ่มแรก ตั้งโจทย์ แล้วก็หาแหล่งข้อมูล หลักๆ จะใช้สีจากตัวละคร เลยต้องหาฐานข้อมูลที่มีชื่อและรูปของตัวละครเพื่อให้ฟลุ๊คไป scrape รูป เรื่องที่อยากเล่าคือฝั่งตัวดีและตัวร้าย ก็เลยต้องไปหาชื่อของตัวละครที่มีการระบุว่าเป็นฝั่งดีและฝั่งร้าย ส่วนข้อมูลอื่นๆที่ใช้ในงาน แต่ละรายการต้องหาจากคนละแหล่งที่มากัน เช่น รายชื่อหนัง ปี การระบุว่าเป็นตัวดีหรือตัวร้าย เลยให้ฟลุ๊คช่วยนำข้อมูลจากแต่ละที่มารวมกันเป็นหนึ่งชีต
ในขั้นตอนดีไซน์ งานนี้ใช้เป็น stack bar chart เรียงข้อมูลลงมาเป็นแถวตามปี แยกฝั่งซ้ายขวาเป็นฝั่งตัวดีกับตัวร้าย เพื่อให้เห็นความแตกต่างหลากหลายของการใช้สี ที่ตั้งใจไว้ เราอยากทำงานแบบดีไซเนอร์จริงๆ คือทำดราฟต์ใน figma แล้วค่อยมา dev ตามแบบที่เราออกแบบไว้จริงๆ แต่พบว่าเราไม่ได้ถนัด figma บางทีการคิดมันตันไปต่อไม่ได้ และค่อนข้างช้าด้วย สุดท้ายเลยมา dev ก่อน แล้วมาเติมแต่งต่อใน phase ของ dev เรารู้สึกว่ามันง่ายกับเรามากกว่า เช่น ป็อปอัป ซึ่งเราไม่ได้ขึ้นใน figma เลย แต่มาใส่ในกระบวนการ dev เลย มันหาทางจบได้ง่ายกว่า เร็วกว่า สรุปคือใช้ figma แค่คร่าวๆ แบบสุดๆ","ลูกคิดตั้งไว้ว่าอยากให้ทำอะไรใหม่ๆ สิ่งที่ยากคือตรงนี้แหละ เราพยายามหาอะไรใหม่ๆ เราติดกับคำนี้มาก คิดว่าต้องเป็นชาร์ตที่ PU ไม่เคยทำ เพื่อที่ทำงานนี้ออกไป ทีมจะได้เห็นอะไรบ้าง แต่สุดท้ายก็จบที่ stack bar chart ก็กลัวว่าคนอื่นจะเซงหรือเปล่า ที่มันดูธรรมดา แต่ลูกคิดบอกว่ามันก็ได้เรียนรู้เรื่องการใช้สีนะ งานของ Punch Up ก็ไม่เคยทำเรื่องสีมาก่อน
เรื่องสีก็เป็นอุปสรรคในการทำงาน เราอยากแสดงสี สุดท้ายต้องมาเรียงลำดับ ไล่สีให้ผู้อ่านเห็นง่ายๆ ที่สุด พอใช้โค้ดลองดึงสีด้วยตัวเอง ก็พบว่ามองยากมาก สีมันมีหลายค่า มี hue, saturation, brightness เราต้องใช้เวลาทำความเข้าใจ logic ของการไล่สี ประมาณหนึ่ง ตอนแรกเราใช้สีจริงจากภาพมาทำ ส่วนใหญ่มันค่อนข้างหม่น และเมื่อการเรียงลำดับแล้วก็ยังมองยากอยู่ เราก็เลยต้องเพิ่มอีกโหมดมาให้มองเฉพาะสีหลักคือค่า hue ซึ่งคือสีที่ไม่ได้ผสมสีอื่นเข้าไป เพื่อให้ผู้อ่านเห็นแล้วทำความเข้าใจได้ง่ายกว่า
ตอนแรกก็ไม่ค่อยเข้าใจวิธีการเรียงสี อย่างสีทึมๆ เราก็ต้องมาเปลี่ยนให้อยู่ในกลุ่มสีดำ เพื่อให้รูปแบบสีออกมาดูง่ายสำหรับคนอ่าน
พอเรารู้สึกว่าเรายังไม่ได้ใส่ความสามารถอะไรใหม่ๆ ในงาน เลยพยายามดึงสีจากภาพด้วยตัวเองที่ front-end จริงๆ มันทำได้แหละ แต่มันหนักมากและทำให้เว็บช้า สุดท้ายก็ไปขอให้ฟลุ๊คทำให้ ทั้งที่ตอนแรกฟลุ๊คก็เสนอว่าจะทำให้ แต่เราคิดว่าอยากทำอะไรเองบ้าง ไม่ใช่ว่ารอข้อมูลเฉยๆ ตอนดึงสีมาจากภาพ มันมีสีแบ็กกราวด์มาด้วย ทั้งที่เราไม่ได้อยากนำเสนอสีพื้นหลัง ตอนแรกสิ่งที่ได้มาเลยไม่ตรงกับความหมายที่เราคิดไว้ เลยต้องให้ฟลุ๊คช่วยใช้เทคนิคตัดแบ็กกราวด์ออกและดึง pallete สีออกมา น่าจะทำให้ข้อมูลออกมาหน้าตาชัดขึ้น","สิ่งที่รู้สึกทำได้ไม่ดีคือการคุยงานกับฟลุ๊ค แวบแรกเราบอกโจทย์ไปประมาณหนึ่ง แต่คิดไปเองว่าสิ่งไหนที่เราทำเองได้ ก็เลยไม่ได้บอกให้เขาทำ หรือไม่ได้อ่านที่มาข้อมูลให้ดีก่อนส่งให้ฟลุ๊ค ไม่ได้ละเอียดกับการหาข้อมูลเท่าที่ควร สุดท้ายก็ต้องส่งแหล่งข้อมูลที่ดีกว่าไปให้ทำใหม่ ซึ่งอาจจะทำให้ฟลุ๊คทำงานยากหน่อย คิดว่าถ้าเราสื่อสารเคลียร์แต่แรกก็น่าจะทำให้ฟลุ๊คทำงานได้ง่ายกว่านี้ บอกว่าเราอยากได้อะไร หรือโจทย์ของเราคืออะไร
ตอนที่เราออกแบบโดยไม่เห็นข้อมูลจริง เพราะข้อมูลยังไม่คลีน เช่น สีตัวละครยังไม่ถูกต้อง ถ้าเห็นข้อมูลไม่ครบ แล้วนำข้อมูลมา viz ก่อน มันจะมองยากว่าเราจะได้ insights อะไรจาก viz นี้ คงจะดีถ้าเราบอกฟลุ๊คให้ทำข้อมูลมาถูกแต่แรก ก็น่าจะทำให้เรานำข้อมูลที่ถูกมาเล่น มาดีไซน์ได้มากกว่านี้ เล่าอะไรได้ตรงและเข้าใจง่ายกว่านี้",ชอบค่ะ (ยิ้ม) ชอบมาก เป็นงานที่ทำให้เรารู้สึกว่าไม่ได้ dev แบบมีความสุขแบบนี้มานานมาก แต่ไม่ใช่ว่างาน PU ไม่สนุกนะ (หัวเราะ) เรานั่งทำไปได้เรื่อยๆ จนไม่ได้สนใจอะไรเลย อยากเติมโน่นเติมนี่ ทำต่อได้ไม่มีวันจบ นั่งทำไปก็ได้เห็นมิติอะไรใหม่ๆ คิดต่อได้เรื่อยๆ เพราะเราอินกับมันแต่แรก สนุกและได้ใช้ความคิดสร้างสรรค์อย่างเต็มที่,Naanong Samretvit,Key,"This project compiles visual data of Disney characters from 1937 to 2024 to analyze and compare the color schemes of hero and villain characters. It aims to observe color trends and diversity over the years, revealing which colors are associated with good and evil from the perspective of Disney's creative storytellers.","I mainly work on the front-end side, bringing the designer's vision to life. I'm really good at using CSS to create layouts, build different elements, and do all sorts of cool styling to match the design perfectly.","When Lookkid told me about this project, I was super excited to design and develop it myself. It was the kind of project I had been waiting for. Usually, I'm always following someone else's lead, but this time I got to follow my own ideas. Sometimes, when a designer gives me an idea, I might suggest something within certain limits. But in this project, the possibilities were wide open. It started with a blank canvas, and I could put whatever I wanted on it.  The theme was movies and animation. When I heard the theme, I immediately thought about Disney because I love watching Disney movies. I was interested in the different characters, but I wasn't sure how to approach it or what dimensions to explore.  Finally, I settled on color. I wanted to see how the use of color for Disney characters changed over the years, both for heroes and villains. I wanted to know if there were any rules for how colors were used for each side and how those trends evolved.  In the past, villains might have been black or purple, but now they probably use a wider range of colors. I wanted to visualize this to see if the data actually supported my hunch.",,"I used Vue, which is my go-to because I wanted to focus more on the design and research aspects. I wanted to have fun with that part rather than the dev side. There wasn't anything particularly new on the dev side. In the end, I went with a simple stacked bar chart, but it was the best way to tell the story I wanted to tell. Choosing that type of visualization meant I didn't need to use any fancy tech.
Actually, there were a lot of new things in this project, like figuring out the main question and the key points I wanted to communicate. And also on the design side, figuring out the best way to visualize the data and what kind of interactive elements or components to include.","First, I defined the question and then found data sources. The main focus was on character colors, so I had to find a database with character names and images for Fluke to scrape. The story I wanted to tell was about heroes and villains, so I had to find character names that were specifically labeled as good or bad. The other data I used in the project came from different sources, such as movie lists, years, and hero/villain designations. So, I had Fluke combine the data from each source into one sheet. For the design, I used a stacked bar chart with the data arranged in rows by year, separating the left and right sides into heroes and villains to show the diversity in color usage. My intention was to work like a real designer, creating a draft in Figma and then developing based on that design. But I realized I wasn't very good at Figma; sometimes I got stuck and it was quite slow. In the end, I developed first and then added details in the dev phase. I felt it was much easier for me that way. For example, I added pop-ups that weren't in the Figma design during the development process. It was easier and faster to find solutions this way. To sum it up, I only used Figma for a very rough outline.","Lookkid wanted us to try something new, and that was the hard part. I was trying so hard to find something new. I got really stuck on that idea, thinking it had to be a chart that Punch Up had never done before, so that the team would see something different. But in the end, I ended up with a stacked bar chart, and I was worried that others might be disappointed because it seemed ordinary. But Lookkid said that it was still a learning experience in terms of using color, and Punch Up hadn't really done much with color before. Color itself was also an obstacle. I wanted to display the colors, and I ended up having to arrange and order them so that they were easy for the reader to see. When I used code to extract the colors myself, I found it was really hard to see because colors have so many values—hue, saturation, brightness. It took some time to understand the logic of color gradients. Initially, I used the actual colors from the images, but most of them were quite dull, and even after ordering them, they were still difficult to see. So, I added another mode to show only the main color, the hue value, which is the color without any other colors mixed in, to make it easier for the reader to understand. At first, I didn't really understand how to arrange the colors. I had to change the dull colors to be in the black group to make the color patterns easier to read. Since I felt like I hadn't really incorporated any new skills into the project, I tried to extract the colors from the images myself on the front-end. It was possible, but it was very resource-intensive and slowed down the website. In the end, I asked Fluke to do it, even though he had offered to do it earlier. I thought I wanted to try something new myself, not just wait for the data. When extracting colors from images, the background colors were also included, even though I didn't want to present them. So, the initial results didn't match what I had in mind. I had to ask Fluke to use techniques to remove the background and extract the color palette. I think that made the data clearer.","What I feel I didn't do well was communicating with the Data Analyst. At first, I gave him a general idea, but I assumed I could do some things myself, so I didn't tell him to do them or didn't carefully read the data source before sending it to him. I wasn't as thorough with the data research as I should have been. In the end, I had to send him a better source and have him redo it, which might have made his work more difficult. I think if I had communicated clearly from the beginning, it would have been easier for Fluke. I should have told him exactly what I wanted or what my goal was. 
Secondly, when I was designing without seeing the actual data because it hadn't been cleaned yet, things like the character colors weren't accurate. If you don't see the complete data and start visualizing it, it's difficult to see what insights you can get from it. It would have been better if I had told Fluke to get the data right from the start. That would have allowed me to play with the correct data and design more effectively, telling a more accurate and understandable story.","I loved it! (smiled) I loved it a lot. It's a project that made me realize I haven't enjoyed developing like this in a long time. But it's not that Punch Up projects aren't fun (laughs). I could just keep working on it and lose track of everything else. I want to add this and that, and it could go on forever. As I worked on it, I saw new dimensions and kept thinking of new ideas because I was so into it from the beginning. It was fun and allowed me to fully utilize my creativity."
